,headline,clickbait,topices,popular_topices
0,get bings,1,0,Entertainment
1,tv female friend group belong,1,0,Entertainment
2,new star war force awakens trailer give chill,1,0,Entertainment
3,vine new york celebrity big brother fucking perfect,1,0,Entertainment
4,couple stunning photo shoot baby learning inoperable brain tumor,1,2,Lifestyle
5,flirt queer girl without making total fool,1,3,Crimes
6,cute thing distract awkward thanksgiving,1,2,Lifestyle
7,disney princess florida,1,0,Entertainment
8,whats quote lyric best describes depression,1,0,Entertainment
9,natalie dormer sam claflin play game see theyd actually last hunger game,1,0,Entertainment
10,perfect response indian patriarchy,1,0,Entertainment
11,time died captain america civil war teaser,1,0,Entertainment
12,time kourtney kardashian shut family,1,1,Politics
13,coffee make poop,1,2,Lifestyle
14,celebrity ex based zodiac,1,0,Entertainment
15,hairdresser struggle every black girl know true,1,2,Lifestyle
16,walter white heisenberg,1,3,Crimes
17,canadian groom ever left wedding plow guest snow storm,1,2,Lifestyle
18,here one really weird thing butterfree,1,0,Entertainment
19,resolution make good,1,0,Entertainment
20,new thing try,1,2,Lifestyle
21,zoo animal around world opening christmas present early,1,2,Lifestyle
22,tell u yourselfie erica ash,1,2,Lifestyle
23,time cried,1,2,Lifestyle
24,vegetarian dump dinner crock pot,1,2,Lifestyle
25,goat bullying tiger friend,1,2,Lifestyle
26,fall show excited give chance avoid,1,1,Politics
27,another round episode stop telling woman smile,1,2,Lifestyle
28,sign stubborn live,1,3,Crimes
29,country singer make music game boy spare time,1,0,Entertainment
30,realize every guy taken,1,0,Entertainment
31,awesome look behindthescenes concept art aladdin,1,2,Lifestyle
32,sarah jessica parker talk carrie hocus pocus love new york,1,0,Entertainment
33,type swearer,1,3,Crimes
34,dad recorded adorable question son asked watching star war first time,1,0,Entertainment
35,impossibly stylish cat gift order awesomeness,1,2,Lifestyle
36,glorious madeup word literature,1,0,Entertainment
37,pranked bunch people dropping iphone front,1,2,Lifestyle
38,flaw every sneakerhead,1,3,Crimes
39,know zodiac sign based cat choose,1,0,Entertainment
40,grime new album heartbreaking inspiration behind oblivion,1,2,Lifestyle
41,instagram account recreating greatest hit barbies,1,3,Crimes
42,best adele meme,1,0,Entertainment
43,picture hot people never understand,1,0,Entertainment
44,badly taking one direction hiatus,1,1,Politics
45,know want christmas based zodiac sign,1,0,Entertainment
46,guy try pinterest leaf hack,1,3,Crimes
47,tip hiking kid every parent know,1,2,Lifestyle
48,scariest halloween candy taste test,1,1,Politics
49,dog begging human forgiveness cutest thing youll see today,1,0,Entertainment
50,here year bollywood cinema four minute,1,2,Lifestyle
51,ed westwick showed emmy party looking like chuck bass dream,1,1,Politics
52,favorite activity visiting family,1,1,Politics
53,take color test see far youd go love,1,2,Lifestyle
54,brave enough date werewolf,1,1,Politics
55,thing everyone hate pda understand,1,2,Lifestyle
56,thing always happen office christmas,1,2,Lifestyle
57,many spongebob face recognize,1,2,Lifestyle
58,golden globe reaction face based zodiac sign,1,2,Lifestyle
59,reason trip costa rica could actually change life,1,0,Entertainment
60,literally photo scotland looking sexy hell,1,2,Lifestyle
61,thing mildly annoy anyone life someone messy,1,1,Politics
62,place music lover go london,1,2,Lifestyle
63,know lyric hotline bling drake,1,0,Entertainment
64,weasley best friend,1,2,Lifestyle
65,book every kid immediately recognize,1,2,Lifestyle
66,organisation trying launch india first transgender model agency,1,3,Crimes
67,request timeout,1,1,Politics
68,issa raes insecure coming hbo long last,1,3,Crimes
69,well know pretty little liar,1,0,Entertainment
70,youve using rice cooker wrong entire time,1,0,Entertainment
71,actor color nominated oscar year people pissed,1,0,Entertainment
72,guy totally nailed modern day aladdin would look like,1,2,Lifestyle
73,easy delicious onepan breakfast,1,3,Crimes
74,tried magic wand here happened,1,2,Lifestyle
75,charli xcx looked like space dominatrix mtv emas,1,2,Lifestyle
76,avenger looked like originally comic,1,0,Entertainment
77,reason urinal worst human invention time,1,2,Lifestyle
78,get free car oprah free tub vaseline tyra,1,1,Politics
79,canadian crime ever committed,1,2,Lifestyle
80,beautiful place scotland give people feel,1,2,Lifestyle
81,here actually get rid acne body,1,3,Crimes
82,yearold guy got drunk accidentally booked insane vacation,1,2,Lifestyle
83,asked guy going buy leona lewis exclusive grindr album,1,0,Entertainment
84,delicious thanksgiving dessert arent pie,1,2,Lifestyle
85,country star jason aldean wore blackface halloween dress lil wayne,1,2,Lifestyle
86,time college literally sucked life,1,0,Entertainment
87,hardest america next top model quiz youll take today,1,0,Entertainment
88,color test determine like masturbate,1,1,Politics
89,romantic line ya literature,1,0,Entertainment
90,reporter responded vulgar comment awesome mama joke,1,3,Crimes
91,people smooth af,1,2,Lifestyle
92,bart lisa,1,2,Lifestyle
93,zodiac sign compatible,1,0,Entertainment
94,well remember vampire diary murder house party,1,0,Entertainment
95,well remember sabrina teenage witch,1,1,Politics
96,sign grew san francisco,1,3,Crimes
97,say someone chronic pain hear,1,1,Politics
98,totally amazing bodycon look youll wan na rock fall,1,0,Entertainment
99,there amazing new beauty box catering woman color,1,0,Entertainment
100,taught grandma nae nae cute af,1,3,Crimes
101,perfect product embracing inner kanye,1,2,Lifestyle
102,here draw hand maybe,1,3,Crimes
103,identify movie based main character bff,1,0,Entertainment
104,tweet prove brain real dick sometimes,1,2,Lifestyle
105,badass lady valentine based one question,1,0,Entertainment
106,anna camp skylar astin engaged everything finally right world,1,0,Entertainment
107,people pretending faint front dog see react,1,3,Crimes
108,smith lyric real fake,1,0,Entertainment
109,esp,1,3,Crimes
110,tell date four question biryani,1,1,Politics
111,tweet brace way real,1,2,Lifestyle
112,dad surprised kid military homecoming dressing gift elf,1,2,Lifestyle
113,honest would hit,1,2,Lifestyle
114,know play private session,1,1,Politics
115,post prove coconut oil answer problem,1,2,Lifestyle
116,item anyone love burger need,1,2,Lifestyle
117,confession people slightly obsessed outer space,1,2,Lifestyle
118,thing vegetarian couple get,1,2,Lifestyle
119,ferrell new badass santa,1,0,Entertainment
120,mark ruffalo posted shirtless pic promoting breast cancer awareness men,1,2,Lifestyle
121,nobody like hand job,1,3,Crimes
122,pinky brain,1,3,Crimes
123,additional episode making murderer made yet,1,3,Crimes
124,time priyanka chopra goddamn owned,1,0,Entertainment
125,best tumblr meme,1,3,Crimes
126,picture way real fourperson family,1,0,Entertainment
127,people slayed eyeshadow game,1,3,Crimes
128,thing probably shouldnt say someone depression,1,2,Lifestyle
129,someone illustrated leslie knopes compliment theyre pretty damn cool,1,2,Lifestyle
130,people dont know david bowie clear,1,2,Lifestyle
131,gay drama teacher responds perfectly mother pull kid class,1,2,Lifestyle
132,best server meme internet,1,3,Crimes
133,try guess chip smashed,1,0,Entertainment
134,good spelling actually,1,0,Entertainment
135,would friend blair serena,1,0,Entertainment
136,anyone tired go weekend,1,2,Lifestyle
137,people go therapy want know,1,2,Lifestyle
138,here photo buff john krasinski hour hard handle,1,1,Politics
139,obscure thing make sexy halloween,1,2,Lifestyle
140,sweary british word need use right,1,3,Crimes
141,rare photo albert einstein youve probably never seen,1,2,Lifestyle
142,reason kendrick sampson htgawm ultimate bae,1,2,Lifestyle
143,struggle woman understand well,1,2,Lifestyle
144,mumbai sending powerful message love support solidarity paris,1,1,Politics
145,thought stalking ex facebook,1,2,Lifestyle
146,im immigrant im,1,0,Entertainment
147,guy cheese vine perfectly sum silly daily mail,1,2,Lifestyle
148,reenacted kid said black leader amazing,1,3,Crimes
149,movie shitton lesbian subtext,1,0,Entertainment
150,book perfectly capture immigrant experience,1,0,Entertainment
151,bean meme twitter account actually matter,1,3,Crimes
152,confession masturbation thatll make go wtf,1,2,Lifestyle
153,secondary character friend v,1,0,Entertainment
154,belong london san francisco,1,3,Crimes
155,potato recipe illegal,1,2,Lifestyle
156,chart graph every james bond fan get,1,2,Lifestyle
157,well know season one buffy,1,0,Entertainment
158,true new jerseyans ace quiz,1,1,Politics
159,diy oreo churros nextlevel glorious,1,0,Entertainment
160,gift every classical music nerd love,1,2,Lifestyle
161,hilarious tweet every book lover appreciate,1,2,Lifestyle
162,christmas movie watch right,1,0,Entertainment
163,well remember season walking dead,1,0,Entertainment
164,time try guy went little far,1,2,Lifestyle
165,thing never say someone big boob,1,2,Lifestyle
166,netflix chill honest,1,2,Lifestyle
167,wounded veteran service dog best man itll make bawl,1,0,Entertainment
168,youth football player quit game whipnae nae,1,3,Crimes
169,here make birthday cake youll ever need,1,0,Entertainment
170,bffs slaying internet fashion,1,3,Crimes
171,dear world word advice india butt dirty,1,0,Entertainment
172,would pas environmental science,1,1,Politics
173,thing youll get youre obsessed bath,1,2,Lifestyle
174,amber rose lot say kanye twitter war,1,2,Lifestyle
175,important life lesson hunger game taught u,1,3,Crimes
176,gamechanging eyeliner chart suck makeup,1,2,Lifestyle
177,beauty hack try,1,2,Lifestyle
178,thing woman arent makeup understand,1,2,Lifestyle
179,hit thatll make feel old af,1,2,Lifestyle
180,picture show terrible start,1,3,Crimes
181,whats beautiful college campus world,1,2,Lifestyle
182,urban dictionary definition need know,1,2,Lifestyle
183,here everything need know renter insurance,1,3,Crimes
184,adele said mic dropped piano thats grammy performance,1,0,Entertainment
185,celebrity baby said hello,1,0,Entertainment
186,silly assumption single thirty,1,2,Lifestyle
187,food electric picnic year look amazing,1,3,Crimes
188,dragon ball z character realistic proportion,1,0,Entertainment
189,ridiculously awkward sex question parent actually asked kid,1,2,Lifestyle
190,time costco failed hard almost,1,1,Politics
191,xmen character based zodiac sign,1,0,Entertainment
192,thing slytherins need,1,0,Entertainment
193,people going really hard time job costume,1,2,Lifestyle
194,need acknowledge niall underrated member one direction,1,0,Entertainment
195,know many time masturbated last week,1,3,Crimes
196,nick joe jonas,1,2,Lifestyle
197,straight woman tinder taught,1,2,Lifestyle
198,youll tear hearing josh groban kelly clarkson duet,1,1,Politics
199,easy slow cooker soup warm right,1,2,Lifestyle
200,dessert prove bourbon make everything better,1,2,Lifestyle
201,time liz lemon spoke goddamn truth,1,2,Lifestyle
202,wedding magazine realistic,1,3,Crimes
203,oscar nominee brie larson music career time,1,0,Entertainment
204,explaining rap lyric get fired election candidate canada,1,1,Politics
205,ooey gooey snack take cheese next level,1,2,Lifestyle
206,oscar winner based zodiac sign,1,0,Entertainment
207,adele currently experiencing put u last four year,1,2,Lifestyle
208,thing see go tim hortons,1,0,Entertainment
209,weird thing never knew word,1,2,Lifestyle
210,instagram photo every short girl relate,1,2,Lifestyle
211,delicious winter smoothy jump start morning,1,2,Lifestyle
212,breaking bad character said famous last word,1,0,Entertainment
213,weird punishment people actually got kid,1,2,Lifestyle
214,jamie claire looking damn good outlander season,1,0,Entertainment
215,literally bunch fucked meme caillou great,1,0,Entertainment
216,tinker bell belle,1,3,Crimes
217,rihanna drake cute work video hurt,1,0,Entertainment
218,ryan phillippe come amy schumer deleted trainwreck scene,1,2,Lifestyle
219,matthew mcconaughey reached peak hot dad mode,1,1,Politics
220,animal masturbation fact make feel better single af,1,2,Lifestyle
221,moment starbucks barista deaf customer going viral,1,2,Lifestyle
222,insanely delicious way eat leftover halloween candy,1,2,Lifestyle
223,here like physically cant pierce ear,1,3,Crimes
224,adam woodyatt upset howsadam moment didnt happen corrie live episode,1,2,Lifestyle
225,watch netflix october,1,2,Lifestyle
226,really delicious dinner week,1,2,Lifestyle
227,would disney movie life like,1,0,Entertainment
228,lego movie character,1,0,Entertainment
229,remember lyric naked mole rap kim possible,1,0,Entertainment
230,percent vegan,1,2,Lifestyle
231,new trailer orange new black look seriously intense,1,3,Crimes
232,perpetually miserable disney character really,1,0,Entertainment
233,easy holiday gift give everyone squad,1,2,Lifestyle
234,here make floral dog leash winter wedding,1,3,Crimes
235,dont fuck crocodile,1,3,Crimes
236,new trailer secret life pet adorable,1,0,Entertainment
237,here mindblowing harry potter fan theory avada kedavra curse,1,0,Entertainment
238,black friday chance get naked palette sale,1,1,Politics
239,korean pop star cant stop falling stage performance,1,1,Politics
240,film pixars tribute classic cinema brilliant,1,2,Lifestyle
241,twoperson costume guaranteed halloween game,1,2,Lifestyle
242,struggle everyone done dissertation understand,1,2,Lifestyle
243,rory williams pretty much graduated companion doctor legend tomorrow,1,2,Lifestyle
244,every girl tried makeup tutorial recognize struggle,1,2,Lifestyle
245,time hipster britain went damn far,1,2,Lifestyle
246,percentage kardashian based question,1,1,Politics
247,bang make celebrity bangable,1,2,Lifestyle
248,pooped pant,1,0,Entertainment
249,here get sick youre traveling,1,2,Lifestyle
250,cast park rec first episode v last episode,1,0,Entertainment
251,actually prefer chris pratt chris hemsworth,1,1,Politics
252,need talk american thanksgiving,1,2,Lifestyle
253,picture way real final,1,0,Entertainment
254,actually know much alcohol youre drinking,1,0,Entertainment
255,behold terrifying mascot ever exist,1,0,Entertainment
256,fan genius player,1,0,Entertainment
257,white chick,1,1,Politics
258,favorite pop diva looked like v,1,0,Entertainment
259,kanye west wiz khalifa officially drama free,1,2,Lifestyle
260,worst time make eye contact,1,2,Lifestyle
261,lastminute stocking stuffer every fandom,1,2,Lifestyle
262,remember people thought green mm made horny,1,3,Crimes
263,every piece evidence prof anna faris chris pratt cutest family existence,1,0,Entertainment
264,male actor get christmas based first letter name,1,0,Entertainment
265,michael b jordan got laid fuck filming creed,1,3,Crimes
266,remember lyric last friday night katy perry,1,2,Lifestyle
267,people tried figure max ruby parent,1,2,Lifestyle
268,favorite classic video game mascot say,1,0,Entertainment
269,get oscar leonardo dicaprio,1,0,Entertainment
270,thing russia differently everywhere else earth,1,1,Politics
271,nostalgic video game mashups thatll grooving,1,2,Lifestyle
272,year chart,1,2,Lifestyle
273,lifechanging way eat pbj,1,2,Lifestyle
274,rachel bilson kristen bell new momfriend goal,1,1,Politics
275,could coolest baby name,1,0,Entertainment
276,question gay people bisexual people,1,1,Politics
277,ask expert mindfulness try,1,0,Entertainment
278,here beauty ad would look like used advertised product,1,2,Lifestyle
279,product people completely obsessed poodle,1,0,Entertainment
280,kathy griffin kristin chenoweth talk worst heckler story,1,3,Crimes
281,pope hot track fall anthem,1,0,Entertainment
282,know walking dead character based zodiac,1,0,Entertainment
283,hardest alt rock music video quiz youll ever take,1,0,Entertainment
284,healthy onthego breakfast idea,1,2,Lifestyle
285,moment pride prejudice make heart melt,1,2,Lifestyle
286,identify show looking old tv guide cover,1,0,Entertainment
287,item splurge,1,1,Politics
288,ghost movie required watching horror fan,1,0,Entertainment
289,way relate squidward tentacle winter,1,2,Lifestyle
290,gorgeous londoninspired tattoo youll absolutely love,1,0,Entertainment
291,indian dancer sex reassignment surgery live boyfriend pakistan,1,1,Politics
292,said bob burger edition,1,2,Lifestyle
293,tell model famous parent,1,0,Entertainment
294,cry koala cutest thing youll see today,1,0,Entertainment
295,cam newton pant arent even worst thing picture,1,0,Entertainment
296,mcdonalds v,1,1,Politics
297,people revolutionising india fight lgbt right,1,0,Entertainment
298,men get transformed disney princess,1,0,Entertainment
299,hip,1,3,Crimes
300,thing didnt look like penis,1,2,Lifestyle
301,taylor swift new video load callback harry style,1,2,Lifestyle
302,know relationship status based dont follow instagram,1,0,Entertainment
303,truth people love wine,1,2,Lifestyle
304,thought hotel safe secure think,1,3,Crimes
305,product people completely obsessed pizza,1,2,Lifestyle
306,cast gilmore girl first episode last episode,1,0,Entertainment
307,jennifer lawrence surprised amy schumer best gift emmy win,1,2,Lifestyle
308,two rat fought slice pizza new york city,1,3,Crimes
309,take deep dive disgustingly adorable relationship,1,0,Entertainment
310,here celebrity saying oscarssowhite,1,0,Entertainment
311,people took passiveaggressive new level,1,3,Crimes
312,thing people anxiety want know,1,2,Lifestyle
313,photo prove snoop dogg greatest hair time,1,2,Lifestyle
314,time mythbusters took job bit far,1,3,Crimes
315,brilliant way dress pound chicken,1,2,Lifestyle
316,image hiv affect life around world,1,2,Lifestyle
317,here looked like behind scene fuller house,1,0,Entertainment
318,secret want tell ex,1,2,Lifestyle
319,well remember scream,1,0,Entertainment
320,muppet baby grew went high school,1,0,Entertainment
321,memoriam shia labeoufs beautiful gorgeous rattail,1,0,Entertainment
322,way make shower best place earth,1,2,Lifestyle
323,burning question fuller house need answer asap,1,0,Entertainment
324,cheap v expensive tequila taste test,1,1,Politics
325,best accidental butt,1,0,Entertainment
326,selena gomez reveals underwent chemotherapy people thought rehab,1,0,Entertainment
327,rigged crane game youll ever see,1,1,Politics
328,meghan trainor ariana grande teamed new song,1,2,Lifestyle
329,celebrity halloween costume edition,1,2,Lifestyle
330,remember disney star sang lyric,1,0,Entertainment
331,four question decide tell crush feel,1,2,Lifestyle
332,guess big boob,1,2,Lifestyle
333,donald trump man bun haunt grave,1,0,Entertainment
334,airplane food economy v first class airline,1,1,Politics
335,thing ginger really want nongingers know,1,0,Entertainment
336,dont watch rent adult youll realize annoying,1,2,Lifestyle
337,best picture winner watch based emoji preference,1,0,Entertainment
338,everything need know upcoming season out,1,0,Entertainment
339,problem people always cold understand,1,2,Lifestyle
340,type person marry based food preference,1,3,Crimes
341,cast hamilton next reallife historical character,1,0,Entertainment
342,lazy today,1,2,Lifestyle
343,evolution michael cliffords hair,1,2,Lifestyle
344,stay home school,1,1,Politics
345,picture wont make sense noncat people,1,0,Entertainment
346,trust friend,1,2,Lifestyle
347,time always sunny made laugh uncontrollably,1,2,Lifestyle
348,fluffy puppy might actually bear,1,3,Crimes
349,time ok hit panic button,1,0,Entertainment
350,love bed people,1,0,Entertainment
351,household ingredient actually skin,1,2,Lifestyle
352,thought everyone stoned af,1,2,Lifestyle
353,well remember lyric school rock,1,0,Entertainment
354,vintage picture paris life,1,0,Entertainment
355,time taylor swift totally understood cat lady life best life,1,2,Lifestyle
356,ahs hotel character based zodiac sign,1,0,Entertainment
357,next boyfriend like,1,0,Entertainment
358,worst version favourite mariah carey song,1,0,Entertainment
359,caitlyn jenner moment felt proud woman,1,2,Lifestyle
360,sea otter learned use inhaler got asthma,1,1,Politics
361,reason paris capital world,1,0,Entertainment
362,useful thing people never remember shit,1,2,Lifestyle
363,mumbai police identified various potentially dangerous place selfie zone,1,0,Entertainment
364,essay read getting ghosted sex til marriage sexist book,1,0,Entertainment
365,percent awkward based zodiac sign,1,0,Entertainment
366,robert pattinson thought twilight character suicidally depressed,1,2,Lifestyle
367,important thing happened golden globe award,1,2,Lifestyle
368,tell chris liam hemsworth,1,1,Politics
369,ridiculously clever group halloween costume,1,2,Lifestyle
370,iconic kim kardashian tweet word,1,1,Politics
371,hearty soup stew chili thatll fill keep warm,1,2,Lifestyle
372,story david bowie blasting mtv playing black artist going viral,1,0,Entertainment
373,celebrity name always google,1,2,Lifestyle
374,taylor swift disappeared face earth worried,1,0,Entertainment
375,loaded cheese stuffed mashed potato ball,1,2,Lifestyle
376,neon genesis evangelion character,1,3,Crimes
377,thing girl love boob,1,2,Lifestyle
378,word mean something completely different target,1,0,Entertainment
379,fearful confession people entering new relationship,1,2,Lifestyle
380,guess kardashianjenner sister favorite based three question,1,0,Entertainment
381,tell u zodiac sign well guess went bed last night,1,0,Entertainment
382,chanel oberlin quote motivational poster,1,2,Lifestyle
383,whats craziest experience youve ever vibrator,1,2,Lifestyle
384,kid new york kid los angeles go city better,1,1,Politics
385,insanely colorful meal healthy af,1,2,Lifestyle
386,surprising confession people got back ex,1,2,Lifestyle
387,hot af male model sexually awaken,1,0,Entertainment
388,here right kind lube every kind sex,1,0,Entertainment
389,even kim kardashian wish kanye rolling stone cover real,1,1,Politics
390,blasphemous thing ever said twitter,1,0,Entertainment
391,gorilla looked guy went pic phone,1,2,Lifestyle
392,way getting cat totally wreck life,1,2,Lifestyle
393,photo drake hot youll go emergency room,1,0,Entertainment
394,make dinner week,1,2,Lifestyle
395,terrifying thing justin bieber fan done,1,0,Entertainment
396,im asexual im,1,0,Entertainment
397,cemitas mexico delicious dish try,1,3,Crimes
398,teeny tiny silver necklace need,1,0,Entertainment
399,celebrity twitter bio based zodiac,1,0,Entertainment
400,u music festival attend year,1,0,Entertainment
401,thing need cook october,1,2,Lifestyle
402,youve making thanksgiving turkey wrong way whole life,1,2,Lifestyle
403,said rupauls drag race edition,1,3,Crimes
404,whats chocolate iq,1,0,Entertainment
405,rock wore crushedvelvet suit nothing ever,1,2,Lifestyle
406,name,1,0,Entertainment
407,woman using dead fish makeup accessory,1,0,Entertainment
408,lola kalyeserye based really hard question,1,0,Entertainment
409,perfect outfit wear fall wedding,1,2,Lifestyle
410,three minute chocolate chip cooky everything,1,2,Lifestyle
411,match boy boy band,1,0,Entertainment
412,need talk matt healys guyshadow,1,1,Politics
413,guy invented rorschach test really hot,1,1,Politics
414,think scream queen killer,1,0,Entertainment
415,drake song would titled honest,1,0,Entertainment
416,find next healthy recipe buzzfeed food newsletter,1,2,Lifestyle
417,time kardashians proved theyre actually hilarious,1,2,Lifestyle
418,rotties actually big teddy bear,1,3,Crimes
419,song always make feel like badass,1,2,Lifestyle
420,competed make best pizza wolfgang puck total mess,1,2,Lifestyle
421,everything need know woman standing field,1,2,Lifestyle
422,tumblr post ya novel thatll make laugh every time,1,0,Entertainment
423,thing make british people feel slightly guilty,1,2,Lifestyle
424,mindblowingly delicious noodle try nyc,1,1,Politics
425,sign youre mum house,1,2,Lifestyle
426,italian dish everyone know,1,3,Crimes
427,actually move canada,1,0,Entertainment
428,many top tv show time seen,1,0,Entertainment
429,text mom definitely sent,1,2,Lifestyle
430,oneeyed cat conquered fear ocean learned surf,1,0,Entertainment
431,thing girl grew rom coms relate,1,0,Entertainment
432,best thing ever happened grocery store,1,2,Lifestyle
433,relationship problem real people anxiety,1,2,Lifestyle
434,heartpounding moment nonstop bbc four sleigh ride,1,3,Crimes
435,snapchat ran ad booze hajj story,1,2,Lifestyle
436,here starbucks red cup controversy make sense,1,2,Lifestyle
437,reminder keira knightley used dress like,1,0,Entertainment
438,orangutan rolling ground laughing make fucking day,1,1,Politics
439,john krasinski talking much love emily blunt destroy,1,0,Entertainment
440,type thot,1,3,Crimes
441,many kardashian sister find mini crossword,1,0,Entertainment
442,dont know clermont twin better ask somebody,1,3,Crimes
443,netflix chilling,1,0,Entertainment
444,hey guy whats cheese stick,1,2,Lifestyle
445,thing happen bff depression,1,2,Lifestyle
446,well actually see color purple,1,0,Entertainment
447,guess much extravagant wedding really cost,1,3,Crimes
448,knowles sister,1,0,Entertainment
449,actually helpful tip dealing panic attack,1,1,Politics
450,glorious mashup biggest movie blow away,1,0,Entertainment
451,here actually start exercising,1,3,Crimes
452,thing minnesotan born knowing,1,3,Crimes
453,watch nerdy daredevil solve rubiks cube skydiving stomach fall as,1,2,Lifestyle
454,life hack make feel like shit together,1,2,Lifestyle
