,headline,clickbait,topices,popular_topices
7914,small thing actually huge people anxiety,1,2,Lifestyle
7915,everything need know new favorite supermodel,1,0,Entertainment
7916,trunkortreat idea guaranteed win halloween,1,2,Lifestyle
7917,joke office never get old,1,2,Lifestyle
7918,hilarious tweet every grammar nerd appreciate,1,2,Lifestyle
7919,star war mean,1,0,Entertainment
7920,badass female tv character total role model,1,0,Entertainment
7921,disney villain reimagined without makeup,1,0,Entertainment
7922,leonardo dicaprio world awkward high five golden globe,1,2,Lifestyle
7923,everyones freaking season premiere arrow,1,0,Entertainment
7924,time social medium saved day,1,3,Crimes
7925,craziest thing youve seen dentist,1,2,Lifestyle
7926,everyone still haunted fucking shirley temple informercial,1,0,Entertainment
7927,here help india yearold sprinter get olympics,1,3,Crimes
7928,best college bar america,1,2,Lifestyle
7929,weirdest news story new jersey,1,0,Entertainment
7930,anne hathaway shared empowering photo paparazzo tried take picture baby bump,1,2,Lifestyle
7931,pigskin blanket nfl week pick,1,3,Crimes
7932,famous car,1,0,Entertainment
7933,need talk sad puffin look,1,3,Crimes
7934,time michael ian black tweet made laugh loud,1,2,Lifestyle
7935,insanely easy minute pizza snack,1,2,Lifestyle
7936,cinderella cubanamerican,1,1,Politics
7937,company may created comfortable men underwear,1,3,Crimes
7938,expensive geeky item people money burn,1,1,Politics
7939,sat entire new justin bieber album here sound like,1,0,Entertainment
7940,guess christmas song one lyric,1,0,Entertainment
7941,basically everyone need try working dj khaled,1,2,Lifestyle
7942,drake jay z clearly blast warrior game,1,3,Crimes
7943,thing romantic film terrible real life,1,2,Lifestyle
7944,mom tell u survived bedrest,1,2,Lifestyle
7945,would harry potter wand core based zodiac sign,1,2,Lifestyle
7946,million people fallen love preemie twin holding hand,1,3,Crimes
7947,reallife childhood fear make laugh,1,2,Lifestyle
7948,way ghost problem,1,2,Lifestyle
7949,tv channel done perfect joke groundhog day,1,3,Crimes
7950,here ultimate playlist get stage breakup,1,0,Entertainment
7951,blood type determine personality type,1,1,Politics
7952,vine perfectly sum human experience,1,0,Entertainment
7953,time ginger snap perfectly summed teen girl angst,1,0,Entertainment
7954,teen going rule world,1,0,Entertainment
7955,delicious meal made,1,3,Crimes
7956,glitch wtf theyll make laugh uncontrollably,1,2,Lifestyle
7957,reason jos louis ultimate culinary delight,1,0,Entertainment
7958,whats horoscope week december,1,2,Lifestyle
7959,thing need know david koechner,1,2,Lifestyle
7960,incredibly beautiful wedding cake,1,2,Lifestyle
7961,picture way real people shed lot,1,2,Lifestyle
7962,amanda seyfried justin long split proving year love died,1,1,Politics
7963,insane pizza mashups delicious af,1,2,Lifestyle
7964,website tell favorite band emo,1,0,Entertainment
7965,time bonfire night confused hell world,1,1,Politics
7966,dude built giant cardboard fortress middle office,1,2,Lifestyle
7967,first date rule straight men dont want die alone,1,2,Lifestyle
7968,lyric valentine day instagram caption,1,0,Entertainment
7969,madeleine albright remembers awesomely weird gilmore girl guest appearance,1,3,Crimes
7970,thoughtful gift office best friend,1,2,Lifestyle
7971,photo oscar isaac proudly gazing golden globe,1,2,Lifestyle
7972,beard undercut combination awaken sexually,1,0,Entertainment
7973,difficult choice youll make,1,0,Entertainment
7974,time silently judge people,1,3,Crimes
7975,husband crushed whole marriage thing,1,0,Entertainment
7976,situation real naturally unlucky people,1,0,Entertainment
7977,picture leave asking lot question,1,0,Entertainment
7978,know eye color based favorite eyeliner style,1,0,Entertainment
7979,tv show g,1,0,Entertainment
7980,lot people sharing bizarre unexpected come dine ending,1,2,Lifestyle
7981,adult reveal hilarious story last time peed,1,2,Lifestyle
7982,wendy williams attempt guess terrible celebrity painting,1,0,Entertainment
7983,insanely adorable jamie scott quote one tree hill,1,2,Lifestyle
7984,tell joke simpson one still,1,2,Lifestyle
7985,quick easy dinner make week,1,2,Lifestyle
7986,hey ed westwick,1,1,Politics
7987,little boy driven around furry best friend,1,0,Entertainment
7988,know favorite celebrity based favorite agent shield character,1,0,Entertainment
7989,nicki minajs latest selfie come amazing inspirational message,1,0,Entertainment
7990,tell whether youre clean gross answering question,1,1,Politics
7991,try tasty treat super bowl party,1,2,Lifestyle
7992,wtf cat picture make laugh every time,1,2,Lifestyle
7993,gifs chris evans pretending cant pushup important,1,0,Entertainment
7994,literally cant tell difference nolte busey,1,0,Entertainment
7995,struggle talkative people never understand,1,2,Lifestyle
7996,people truly born job,1,3,Crimes
7997,tweet way funny anyone boob,1,2,Lifestyle
7998,dave grohls red solo cup best part grammys,1,0,Entertainment
7999,excellent deal get weekend,1,1,Politics
8000,here ciaras postbaby style dope af,1,3,Crimes
8001,aussie reveal love hate britain,1,1,Politics
8002,stealthy product thatll protect thing,1,2,Lifestyle
8003,fan art star war force awakens staggeringly beautiful,1,0,Entertainment
8004,old young soul based zodiac,1,0,Entertainment
8005,profoundly beautiful quote life death,1,3,Crimes
8006,gift list hack might actually save holiday,1,2,Lifestyle
8007,time tumblr went way fucking far,1,2,Lifestyle
8008,small thing gender dysphoria get,1,0,Entertainment
8009,beautiful thing home cost le,1,2,Lifestyle
8010,new hair dyeing technique actually give mermaid hair,1,2,Lifestyle
8011,yearold may best canadian neighbour canada,1,3,Crimes
8012,karaoke song perfect partner,1,2,Lifestyle
8013,taylor swift say learned lesson whole nicki minaj debacle,1,0,Entertainment
8014,marine animal match zodiac sign,1,0,Entertainment
8015,know job based random question,1,0,Entertainment
8016,thought exam,1,2,Lifestyle
8017,time dog didnt try hide feeling,1,2,Lifestyle
8018,hogwarts house disney princess belong,1,0,Entertainment
8019,way today special wtf kid show ever,1,2,Lifestyle
8020,thing might common helga pataki,1,0,Entertainment
8021,redhead truth told tweet,1,2,Lifestyle
8022,best news blooper theyre control,1,2,Lifestyle
8023,everyone losing mind amazing toasted marshmallow milkshake,1,3,Crimes
8024,know youre lipstick lip gloss fan,1,2,Lifestyle
8025,here one tell depression anxiety,1,2,Lifestyle
8026,beautifully designed mermaid tattoo,1,0,Entertainment
8027,know puppy need see right,1,0,Entertainment
8028,here recover fall like supermodel,1,2,Lifestyle
8029,eli manning incredible new nickname,1,0,Entertainment
8030,thing need youre mildly obsessed stuff,1,2,Lifestyle
8031,tell old fucking penny,1,2,Lifestyle
8032,funniest tweet,1,2,Lifestyle
8033,know hate harry potter movie adaptation,1,0,Entertainment
8034,sansa stark finally catch break next season game throne,1,0,Entertainment
8035,know personality based handwriting,1,1,Politics
8036,word search test determine youll get married,1,0,Entertainment
8037,well know autumn leaf,1,1,Politics
8038,bridge spy going dad favorite movie,1,0,Entertainment
8039,proposal cake put proposal shame,1,0,Entertainment
8040,here therapy according therapist,1,0,Entertainment
8041,people simple thing restore faith humanity,1,0,Entertainment
8042,vanity basically porn makeup addict,1,2,Lifestyle
8043,truth nonmormons loved growing mormon community,1,2,Lifestyle
8044,people posting racist comment mac instagram black model,1,3,Crimes
8045,celebrity wax figure perfectly sum relationship bos,1,0,Entertainment
8046,gift naughtiest mom know,1,2,Lifestyle
8047,deliciously decadent lemon dessert die,1,3,Crimes
8048,diy ornament thatll take tree next level,1,2,Lifestyle
8049,one small detail cinderella belle tiana blow mind,1,3,Crimes
8050,rihanna talk chris brown think rachel dolezal kind hero,1,0,Entertainment
8051,amazing woman know better,1,2,Lifestyle
8052,gorgeous moving portrait feature favorite actor channeling classic movie,1,0,Entertainment
8053,lifechanging way eat twix,1,2,Lifestyle
8054,everyone slightly obsessed texas roadhouse bread,1,0,Entertainment
8055,slightly horrifying airport moment make say,1,2,Lifestyle
8056,thing everybody twitter,1,0,Entertainment
8057,jennifer lawrence confessed made liam hemsworth real life,1,1,Politics
8058,daniel craig brutally honest regarding feeling james bond,1,0,Entertainment
8059,magical fact sex wizarding world,1,2,Lifestyle
8060,youve cooking wrong thing crockpot whole time,1,2,Lifestyle
8061,animal impressed life,1,0,Entertainment
8062,broadway star called audience shaming special need child,1,0,Entertainment
8063,fool gold controversial hit discovery channel show went boom bust,1,3,Crimes
8064,would lottery,1,1,Politics
8065,list thing need chill immediately,1,2,Lifestyle
8066,insanely pretty beet recipe valentine day,1,2,Lifestyle
8067,ridiculously delightful gift make,1,2,Lifestyle
8068,time tumblr little accurate hogwarts house,1,0,Entertainment
8069,force awakens character match zodiac sign,1,0,Entertainment
8070,buzzfeed crossword drop beat,1,0,Entertainment
8071,woman endometriosis reveal want everyone know struggle,1,0,Entertainment
8072,much rap fan,1,0,Entertainment
8073,find horoscope week october,1,2,Lifestyle
8074,hilarious tweet prove tyra relatable supermodel ever,1,2,Lifestyle
8075,tweet band actually make laugh,1,2,Lifestyle
8076,startling boob confession,1,2,Lifestyle
8077,people whove personally victimized gps,1,2,Lifestyle
8078,introvert high,1,2,Lifestyle
8079,celebrity pet like pet based one question,1,0,Entertainment
8080,tv mom mom,1,0,Entertainment
8081,character man uncle based zodiac,1,0,Entertainment
8082,here actually like fitbit,1,2,Lifestyle
8083,gwendoline christie showed emmy looking like literal goddess,1,3,Crimes
8084,watch twentysomethings imagine raising future kid,1,2,Lifestyle
8085,model walking victoria secret fashion show,1,3,Crimes
8086,identify popular fastfood item,1,3,Crimes
8087,doctor doctor best,1,2,Lifestyle
8088,hella easy way seriously transform old jean,1,3,Crimes
8089,best boops,1,3,Crimes
8090,drinking underage v drinking legally,1,0,Entertainment
8091,woman text husband everything say sleep hilarious,1,2,Lifestyle
8092,find hilarious dog gif one question,1,0,Entertainment
8093,ian mckellen got choked reading beautiful coming letter,1,1,Politics
8094,reason fall love cat person,1,2,Lifestyle
8095,wtf animal face swap,1,2,Lifestyle
8096,donald trump slug monster inc ease tired heart,1,0,Entertainment
8097,man lived car year,1,3,Crimes
8098,street artist bring anarchy instagram feed,1,2,Lifestyle
8099,look rashida jones flip rewind,1,3,Crimes
8100,truly awkward lube confession,1,2,Lifestyle
8101,thought listening serial surprise second season premiere,1,0,Entertainment
8102,gabrielle union look exactly age,1,0,Entertainment
8103,thing teen cared le seeing justin bieber,1,0,Entertainment
8104,reason marty mcfly flyest guy,1,1,Politics
8105,someone made innout pie beautiful revolting mess,1,2,Lifestyle
8106,italian city live,1,3,Crimes
8107,wonderfully cozy thing need bake fall,1,2,Lifestyle
8108,thing mildly irritate everyone go gym,1,1,Politics
8109,interracial couple share appalling thing people said,1,2,Lifestyle
8110,type hangover everyone least,1,3,Crimes
8111,recipe prove bacon true star thanksgiving,1,2,Lifestyle
8112,dead,1,3,Crimes
8113,best mindy kaling tweet,1,0,Entertainment
8114,mouthwatering minicakes youll never share,1,2,Lifestyle
8115,movieinspired cake film fan appreciate,1,0,Entertainment
8116,watch tiny puppy get massage minute,1,3,Crimes
8117,thing every guy start losing hair,1,2,Lifestyle
8118,cast pretty little liar think wine mom still basement,1,0,Entertainment
8119,there new hairstyle called hun taking,1,1,Politics
8120,morgan freeman really old fun fact,1,2,Lifestyle
8121,artist made tattoo come life mesmerizing,1,0,Entertainment
8122,man share chilling story concert paris terror attack,1,3,Crimes
8123,tried cook eat monstrosity emu egg,1,3,Crimes
8124,schoolthemed wedding idea satisfy inner nerd,1,2,Lifestyle
8125,real struggle anyone grew superfine hair,1,2,Lifestyle
8126,let shia labeouf show proper way wear sweatpants,1,0,Entertainment
8127,indian protesting child marriage hashtag strengthtosayno,1,0,Entertainment
8128,celebrity name according justin bieber,1,0,Entertainment
8129,photo thanksgiving thatll make laugh loud,1,2,Lifestyle
8130,guess often say word fuck,1,3,Crimes
8131,ultimate guide getting published literary magazine,1,3,Crimes
8132,red devil going kill,1,1,Politics
8133,pigskin blanket nfl week pick,1,3,Crimes
8134,woman perfect response final question jeopardy,1,0,Entertainment
8135,hilarious tweet kid way real every parent,1,2,Lifestyle
8136,tried youtube makeup tutorial happened,1,2,Lifestyle
8137,percent katycat,1,2,Lifestyle
8138,tested four longwear lipstick see one lasted longest,1,1,Politics
8139,bhopal government official caught watching porn council meeting,1,1,Politics
8140,new york taxi driver nailed sexiest pose charity pin calendar,1,0,Entertainment
8141,realization woman jean shopping,1,1,Politics
8142,identify famous cartoon character eye,1,0,Entertainment
8143,well know one direction perfect,1,0,Entertainment
8144,guess zodiac sign based pattern choose,1,0,Entertainment
8145,vine account dying laughing,1,2,Lifestyle
8146,thing changed sex life,1,2,Lifestyle
8147,vine remind life always terrible,1,2,Lifestyle
8148,bunch woman wore pant emmy perfect,1,2,Lifestyle
8149,girl instagram,1,0,Entertainment
8150,miyazaki nail art design blow away,1,2,Lifestyle
8151,girl whose entire family got killed act arson want card christmas,1,0,Entertainment
8152,guy decorated entire subway car propose girlfriend,1,0,Entertainment
8153,sport movie get pumped af,1,0,Entertainment
8154,adam driver bringing emo kylo ren vibe snl,1,0,Entertainment
8155,thing mildly thrill everyone work retail,1,1,Politics
8156,well remember intro danny phantom,1,0,Entertainment
8157,disney nickelodeon kid,1,0,Entertainment
8158,tweet chipotle thatll actually make laugh,1,2,Lifestyle
8159,stranger kiss blindfolded guess look like,1,2,Lifestyle
8160,columbus day going rename,1,1,Politics
8161,new alice wonderland movie look really creepy,1,0,Entertainment
8162,insane thing woman actually found boob crack,1,2,Lifestyle
8163,secondday hairstyle tutorial,1,2,Lifestyle
8164,realistic way actually work travel life,1,2,Lifestyle
8165,thing youll understand youre slightly obsessed masturbating,1,2,Lifestyle
8166,make mini nutella pizza,1,2,Lifestyle
8167,cat,1,2,Lifestyle
8168,come attention gigi bella hadids younger brother adorable,1,0,Entertainment
8169,piece wisdom read whenever youre feeling,1,0,Entertainment
8170,badass cat fort,1,0,Entertainment
8171,animal trying get home thanksgiving via turtle taxi,1,2,Lifestyle
8172,awesome holiday thing actually find target,1,2,Lifestyle
8173,everyone made mean girl joke kris jenner victoria secret fashion show,1,3,Crimes
8174,song probably liked feminist awakening,1,0,Entertainment
8175,movie excited see year toronto film festival,1,0,Entertainment
8176,adorable animal advent calendar december,1,0,Entertainment
8177,way forget ex good,1,0,Entertainment
8178,nonprince disney guy soulmate,1,0,Entertainment
8179,tweet tea speak soul,1,0,Entertainment
8180,people react uber passenger rating,1,2,Lifestyle
8181,thing youll understand youre slightly obsessed lush,1,2,Lifestyle
8182,thing dick dick pic might actually want see,1,2,Lifestyle
8183,trash scale,1,1,Politics
8184,kesha new band called yeast infection,1,0,Entertainment
8185,character royal,1,0,Entertainment
8186,offended starbucks cup actually,1,3,Crimes
8187,celtic name beautiful youll want child,1,2,Lifestyle
8188,way michigan fall better state,1,1,Politics
8189,vampire diary character based zodiac sign,1,0,Entertainment
8190,dude selling drug facebook made ridiculously easy police catch,1,2,Lifestyle
8191,well know lyric cake ocean dnce,1,0,Entertainment
8192,fact history teacher forgot mention,1,0,Entertainment
8193,whats best family halloween costume youve ever,1,2,Lifestyle
8194,like emma swan dark swan,1,0,Entertainment
8195,song loved forgot year ago,1,2,Lifestyle
8196,harry potter villain based zodiac,1,0,Entertainment
8197,terrible photoshop regis philbin princess leias bikini,1,3,Crimes
8198,hardest wwe royal rumble quiz youll ever take,1,0,Entertainment
8199,super romantic way tell someone love,1,2,Lifestyle
8200,thing tell best friend right,1,2,Lifestyle
8201,scoobydoo character,1,3,Crimes
8202,triumphant melancholic return world greatest screenwriter,1,3,Crimes
8203,paris hiltons instagram account right hilarious af,1,2,Lifestyle
8204,guess favorite beatle,1,0,Entertainment
8205,disney villain based question disney movie,1,0,Entertainment
8206,review street fighter v another fighting game,1,0,Entertainment
8207,gina rodriguez cutest brought dad golden globe,1,0,Entertainment
8208,dating struggle extroverted lady,1,2,Lifestyle
8209,men tinder need log think done,1,0,Entertainment
8210,here makeup look incredible picture,1,0,Entertainment
8211,guy see one eye bought dog one eye one wanted,1,0,Entertainment
8212,crockpot sweet potato chili,1,2,Lifestyle
8213,jk rowling tweet based zodiac sign,1,0,Entertainment
8214,commercial jingle kid still remember every lyric,1,0,Entertainment
8215,look people choice award,1,2,Lifestyle
8216,pharrell asked bunch kid love reading adorable,1,0,Entertainment
8217,kill,1,3,Crimes
8218,badass couple raised bar engagement photo,1,2,Lifestyle
8219,boozy hot chocolate recipe make winter,1,2,Lifestyle
8220,podcasts subscribing,1,2,Lifestyle
8221,amazing genius eating bathtub,1,2,Lifestyle
8222,character national treasure,1,2,Lifestyle
8223,sarcastic thing time,1,0,Entertainment
8224,favorite cartoon character would look like real life,1,0,Entertainment
8225,face anyone who painfully single recognize immediately,1,2,Lifestyle
8226,thing make somethings feel old,1,2,Lifestyle
8227,time musician made really hard concentrate music,1,0,Entertainment
8228,reason woman long hair,1,2,Lifestyle
8229,regular guy trained like fbi agent day actually nailed,1,3,Crimes
8230,time conan obrien completely owned twitter,1,2,Lifestyle
8231,epic slap incredibly therapeutic watch,1,3,Crimes
8232,struggle every blogger recognize,1,2,Lifestyle
8233,survive getting married parent divorced,1,0,Entertainment
8234,student best hello cover ever encore ellen,1,2,Lifestyle
8235,fox hound tragic disney film ever made,1,0,Entertainment
8236,green gummy bear lying whole life,1,3,Crimes
8237,city ideal guy,1,2,Lifestyle
8238,finn poe star war force awakens,1,0,Entertainment
8239,thing happened year ago month,1,2,Lifestyle
8240,fox hound,1,0,Entertainment
8241,beautifully honest valentine card people single af,1,2,Lifestyle
8242,celebrity turning year,1,0,Entertainment
8243,fact make want throw away makeup,1,2,Lifestyle
8244,nativity scene member,1,1,Politics
8245,someone calculated rich harry potter answer surprising,1,2,Lifestyle
8246,aunty ji swinging park remind never grow,1,0,Entertainment
8247,artist gave disney couple modern makeover theyre fierce af,1,0,Entertainment
8248,adorable little girl prof every girl want princess,1,0,Entertainment
8249,great question answered hot dog sandwich,1,0,Entertainment
8250,reason office worst show time,1,2,Lifestyle
8251,mancan wine exists masculinity fragile fuck,1,2,Lifestyle
8252,cartoon network released first original mobile game,1,0,Entertainment
8253,sign prove bookseller absolute best,1,2,Lifestyle
8254,men grooming product actually worth money,1,2,Lifestyle
8255,here tell friend theyre going bridesmaid,1,2,Lifestyle
8256,australian animal dgaf,1,0,Entertainment
8257,advice graduate make fresher week le terrifying,1,0,Entertainment
8258,picture thatll make want pack bag move wale,1,0,Entertainment
8259,clever way decorate storebought pumpkin pie,1,2,Lifestyle
8260,fear talking phone normal,1,1,Politics
8261,real life like telenovela,1,3,Crimes
8262,photo guaranteed annoy anyone bakes,1,1,Politics
8263,model perfect response reporter asked shed eat fashion show,1,2,Lifestyle
8264,dog want goddamn rain stop,1,0,Entertainment
8265,insanely easy threeingredient dessert,1,3,Crimes
8266,many toy christmas list,1,0,Entertainment
8267,thing cuban view differently,1,1,Politics
8268,racist came halloween party,1,1,Politics
8269,picture real cant pay attention,1,2,Lifestyle
8270,accessory get based favorite food,1,0,Entertainment
8271,whats new york city roommate horror story,1,0,Entertainment
8272,jack black jack white,1,2,Lifestyle
8273,landlord need fucking stopped,1,0,Entertainment
8274,muslim professor offering treat people pork meal stand intolerance,1,1,Politics
8275,fyi drake made one really hot basketball coach,1,0,Entertainment
8276,one ever tell therapy,1,2,Lifestyle
8277,celebrity born day month,1,3,Crimes
8278,firstgeneration american talk american dream,1,3,Crimes
8279,please look baby zebra,1,0,Entertainment
8280,glorious baconwrapped food sexually awaken,1,0,Entertainment
8281,zodiac sign high school musical character,1,0,Entertainment
8282,comedian standup gay indian make new fave,1,2,Lifestyle
8283,thing help talk family eating disorder,1,1,Politics
8284,powerful image marriage equality,1,1,Politics
8285,best meme canada internet,1,3,Crimes
8286,thing martha stewart tweeted make laugh absolutely reason,1,0,Entertainment
8287,dude still going single,1,2,Lifestyle
8288,meet yearold girl vitiligo who making wave model,1,3,Crimes
8289,valentine day gift idea youll wish thought first,1,2,Lifestyle
8290,beautiful shot television,1,3,Crimes
8291,people prove gaptooth smile totally contagious,1,2,Lifestyle
8292,try guy try kpop idol makeup,1,2,Lifestyle
8293,insanely cool gift sane person refuse,1,2,Lifestyle
8294,see guy sweet reaction finding he going dad,1,2,Lifestyle
8295,mom officially outmommed,1,2,Lifestyle
8296,amazing apps revitalize love reading,1,2,Lifestyle
8297,surprising video show depression isnt always obvious,1,2,Lifestyle
8298,youll wish could take dog home see dance,1,2,Lifestyle
8299,national book foundation honoree,1,3,Crimes
8300,excuse make going gym,1,0,Entertainment
8301,ok time vote song summer,1,0,Entertainment
8302,fake orgasm,1,3,Crimes
8303,sign youre relationship,1,0,Entertainment
8304,beyonce jayz singing along britney spear concert give life,1,1,Politics
8305,know marvel superhero based zodiac sign,1,0,Entertainment
8306,mysterious hand justin biebers photo belong,1,0,Entertainment
8307,photo people skipped science wont understand,1,2,Lifestyle
8308,six guy inevitably danced club,1,0,Entertainment
8309,sexy winter drink next time netflix chill,1,2,Lifestyle
8310,life hack disney movie borderline genius,1,0,Entertainment
8311,george takei took internet troll perfect,1,0,Entertainment
8312,canadian kid welcoming refugee make feel feel,1,2,Lifestyle
8313,thing probably didnt know back future trilogy,1,2,Lifestyle
8314,incredibly helpful chart cooking thanksgiving dinner,1,2,Lifestyle
8315,anyone experience regret ejaculating,1,2,Lifestyle
8316,home decor piece make wish dead,1,0,Entertainment
8317,broadway musical see based birth month,1,0,Entertainment
8318,type coworkers absolutely everyone,1,0,Entertainment
8319,hallelujah gigi hadid single,1,0,Entertainment
8320,someone please tell u adorable bear leash,1,3,Crimes
8321,much southerner really,1,0,Entertainment
8322,reason worst year canada ever seen,1,0,Entertainment
8323,guess so star sign based fave legend zelda character,1,0,Entertainment
8324,delicious holiday dessert wont believe sugarfree,1,2,Lifestyle
8325,poppunk band actually belong,1,0,Entertainment
8326,picture people living best onesie life,1,0,Entertainment
8327,unforgivable thing internet minion,1,2,Lifestyle
8328,family weirdest christmas tradition,1,1,Politics
8329,roommate secret make want live alone,1,0,Entertainment
8330,couple reveal biggest pet peeve,1,0,Entertainment
8331,tiffany new york pollard reaction david bowie passing one kind,1,3,Crimes
8332,sign youre old millennial,1,0,Entertainment
8333,nick kroll amy poehler split love dead hatred summer grows,1,0,Entertainment
8334,dog best friend theyre destroying internet heart,1,2,Lifestyle
8335,jennifer lawrence answer question justin bieber hilariously honest,1,0,Entertainment
8336,woman guaranteed make want short bang,1,2,Lifestyle
8337,mitch albom wish werent reading phone,1,3,Crimes
8338,adult watched old christmas classic felt like kid,1,2,Lifestyle
8339,billy corgan named son augustus juppiter,1,1,Politics
8340,adele lady gagas hot bodyguard leave compulsively thrusting,1,0,Entertainment
8341,well remember name disney online game,1,0,Entertainment
8342,people know much pizza matter planet earth,1,0,Entertainment
8343,transparent character,1,3,Crimes
8344,extremely spicy snack taste test,1,1,Politics
8345,gilmore girl storyline fan demand see revival,1,3,Crimes
8346,moment anyone shopped ikea,1,3,Crimes
8347,mom shut hilarious first day school picture,1,0,Entertainment
8348,time victoria beckham actually fucking hilarious,1,2,Lifestyle
8349,here cast hannah montana look like year later,1,3,Crimes
8350,mariah carey peak mariah carey posing beach red full body wetsuit,1,3,Crimes
8351,picture cat watching aristocats,1,0,Entertainment
8352,wheres best place buy bedding,1,2,Lifestyle
