,headline,clickbait,topices,popular_topices
11819,need talk fucking delicious empanadas,1,2,Lifestyle
11820,justin bieber dropped hotline bling remix give much life,1,0,Entertainment
11821,gift idea people obsessed fluffy thing,1,2,Lifestyle
11822,situation made better holiday,1,2,Lifestyle
11823,know zodiac sign based favorite dog breed,1,0,Entertainment
11824,newbie know hitting gym,1,1,Politics
11825,emma watson sharing perfect quote remember alan rickman,1,0,Entertainment
11826,clever product make office much better,1,2,Lifestyle
11827,thing anyone ever student relate,1,2,Lifestyle
11828,hardest premier league badge quiz youll ever take,1,0,Entertainment
11829,time john mulaney funniest man america,1,3,Crimes
11830,know gfs face touch,1,3,Crimes
11831,book helped manage anxiety,1,2,Lifestyle
11832,guy draw octopus portrait vice president,1,0,Entertainment
11833,american horror story gifs perfectly sum period,1,0,Entertainment
11834,thing spending new year eve alone,1,3,Crimes
11835,much whovian,1,0,Entertainment
11836,picture real anyone who lived zara sale,1,3,Crimes
11837,web series helping trans teen find personal definition beauty,1,2,Lifestyle
11838,let tarot help crush,1,3,Crimes
11839,cookie heist,1,0,Entertainment
11840,cara delevingne taylor swift,1,2,Lifestyle
11841,photo youll understand youre slightly obsessed hichews,1,2,Lifestyle
11842,guess age gay porn,1,0,Entertainment
11843,fred savage cant go home,1,0,Entertainment
11844,hamilton guide new york new jersey,1,3,Crimes
11845,original wiggle might reunite winter drill,1,1,Politics
11846,mom posted incredibly raw emotional photo life birth,1,0,Entertainment
11847,here makeahead meal plan anyone cook,1,3,Crimes
11848,beautiful quote make fall love paris,1,2,Lifestyle
11849,pit bull brother cutest thing youll see day,1,0,Entertainment
11850,pigskin blanket nfl week pick,1,3,Crimes
11851,chill as bedroom make want sleep alarm,1,2,Lifestyle
11852,disney sidekick based zodiac sign,1,0,Entertainment
11853,could pas defence dark art owl,1,1,Politics
11854,subtle tasteful white ink tattoo,1,3,Crimes
11855,flawless pic sofia vergara joe manganiellos honeymoon,1,2,Lifestyle
11856,watch trainer get ass kicked aerial yoga,1,3,Crimes
11857,quick healthy salmon dinner anybody make,1,2,Lifestyle
11858,insanely clever response ex text,1,2,Lifestyle
11859,thing disney kid remember,1,0,Entertainment
11860,child latino family reveal sacrifice parent made,1,0,Entertainment
11861,animal following,1,0,Entertainment
11862,guess celebrity tweeted holidaythemed tweet,1,0,Entertainment
11863,biggest moment twitter,1,2,Lifestyle
11864,tell lifetime movie title real,1,0,Entertainment
11865,time celebrity made go wtf,1,2,Lifestyle
11866,best drake meme ever existed,1,0,Entertainment
11867,pacman ghost,1,1,Politics
11868,llama alpaca,1,1,Politics
11869,ruby rose happy revealing photo published,1,2,Lifestyle
11870,hilarious fake literary band name,1,2,Lifestyle
11871,sign best friend becoming person,1,0,Entertainment
11872,food grossest,1,2,Lifestyle
11873,choice color say,1,1,Politics
11874,whats favorite professor snape moment harry potter,1,2,Lifestyle
11875,harry potter deathly hallows,1,0,Entertainment
11876,emergency plan action family member follows twitter,1,1,Politics
11877,people holding rabbit,1,3,Crimes
11878,know favorite music genre based zodiac sign,1,0,Entertainment
11879,best call center meme internet,1,3,Crimes
11880,thing japan rest world desperately need,1,1,Politics
11881,weird animal match zodiac sign,1,0,Entertainment
11882,people make feel better terrible choice,1,2,Lifestyle
11883,cake want everything,1,0,Entertainment
11884,much guy know birth control,1,0,Entertainment
11885,here cast legally blonde look like,1,0,Entertainment
11886,sex hogwarts,1,0,Entertainment
11887,thing single girl tired hearing,1,2,Lifestyle
11888,raddest throwback marriage proposal,1,1,Politics
11889,onesizefitsall beauty product look like different woman,1,0,Entertainment
11890,like wait marriage,1,0,Entertainment
11891,match season gilmore girl quote said,1,0,Entertainment
11892,disney prince hotter aladdin,1,0,Entertainment
11893,struggle growing eyebrow,1,2,Lifestyle
11894,unknowingly gender bias,1,0,Entertainment
11895,well remember playstation game,1,0,Entertainment
11896,would bff scream queen,1,0,Entertainment
11897,picture dog embarrassing situation,1,0,Entertainment
11898,one direction singing one direction car james corden,1,0,Entertainment
11899,doctor doctor best look,1,2,Lifestyle
11900,someone found giant dickshaped icicle cool ball,1,2,Lifestyle
11901,soccer player forgot human,1,1,Politics
11902,gadget every adult need kitchen,1,2,Lifestyle
11903,guess oscar nominated movie short clip,1,0,Entertainment
11904,kanye west smiling picture,1,0,Entertainment
11905,insanely delicious way cook potato thanksgiving,1,2,Lifestyle
11906,red one blue one,1,3,Crimes
11907,question want gilmore girl revival answer,1,0,Entertainment
11908,people reveal happens behind perfect instagram,1,2,Lifestyle
11909,flavorful buffalo chicken slider damn good,1,0,Entertainment
11910,starbucks drink based zodiac sign,1,0,Entertainment
11911,message basically sext parent,1,2,Lifestyle
11912,delightful picture stormtroopers enjoying day,1,0,Entertainment
11913,time bollywood star bravely opened deepest personal struggle,1,2,Lifestyle
11914,perfect anywhere workout,1,2,Lifestyle
11915,used alcoholic im stoner drink sometimes,1,0,Entertainment
11916,people really pissed taylor swift album year,1,2,Lifestyle
11917,star war fan theory kylo ren perfect,1,0,Entertainment
11918,guess buzzfeed employee screen name looking photo,1,0,Entertainment
11919,easy bedroom upgrade change way sleep,1,2,Lifestyle
11920,learned rory gilmore isnt perfect role model,1,2,Lifestyle
11921,costume competition prof simpson fan best world,1,0,Entertainment
11922,know pet based random question,1,0,Entertainment
11923,shia labeouf tweet based zodiac sign,1,0,Entertainment
11924,italian village bucket list,1,0,Entertainment
11925,need see incredible graphic bond girl outfit,1,0,Entertainment
11926,hogwarts house american horror story character belong,1,0,Entertainment
11927,whats terrifying unsolved crime youve ever heard,1,2,Lifestyle
11928,insane thing happened pennsylvania,1,2,Lifestyle
11929,great movie likely missed year totally see,1,2,Lifestyle
11930,everyones freaking girl amazing sexy gandalf costume,1,2,Lifestyle
11931,heartbreaking confession domestic violence survivor,1,2,Lifestyle
11932,totally wild confession sex tape,1,1,Politics
11933,here everyone wore mtv emas,1,2,Lifestyle
11934,tv show reimagined nickelodeon cartoon,1,0,Entertainment
11935,way style hair gym actually awesome,1,2,Lifestyle
11936,literally bunch really funny tweet,1,2,Lifestyle
11937,year ago golden globe looked like,1,2,Lifestyle
11938,canadian thing youll ever see,1,2,Lifestyle
11939,fabulous hack make shoe look fit perfectly every time,1,0,Entertainment
11940,creative way use selfie stick,1,2,Lifestyle
11941,masterfully punny tweet make laugh loud,1,2,Lifestyle
11942,pc lover try using mac,1,2,Lifestyle
11943,hilarious bollywood movie review commenters torrent site,1,2,Lifestyle
11944,tom hardy wife revealed shes pregnant movie premiere,1,0,Entertainment
11945,yeah taco bell drive sign look like giant penis,1,0,Entertainment
11946,whats funniest bob burger moment,1,2,Lifestyle
11947,movie show stream cold,1,2,Lifestyle
11948,adorable red panda product need life,1,2,Lifestyle
11949,musthave high street product natural hair,1,0,Entertainment
11950,pic thanksgiving,1,2,Lifestyle
11951,know tv couple based favorite lush bath bar,1,0,Entertainment
11952,dumb thing patient told doctor,1,3,Crimes
11953,historical woman dgaf breastfeeding public,1,0,Entertainment
11954,tell food makeup eyebrow,1,2,Lifestyle
11955,freshman senior year,1,2,Lifestyle
11956,picture people never understand,1,2,Lifestyle
11957,joseph gordonlevitt made diy yoda costume star war premiere,1,0,Entertainment
11958,tyra tiffany top model,1,3,Crimes
11959,delightful word language bodily function,1,0,Entertainment
11960,little detail probably missed fifth element,1,2,Lifestyle
11961,would amortentia smell like,1,3,Crimes
11962,craziest thing people done impress crush,1,2,Lifestyle
11963,people tried pumpkin spice latte first time honest,1,3,Crimes
11964,completely unreasonable thing everyone think crush,1,3,Crimes
11965,smell people finger dont,1,3,Crimes
11966,gift every runner get christmas,1,2,Lifestyle
11967,reason daniel norris absolute human perfection,1,2,Lifestyle
11968,here cast halloweentown look like today,1,0,Entertainment
11969,sum struggle online dating,1,2,Lifestyle
11970,whats funniest reason youve cried period,1,2,Lifestyle
11971,australian celebrity date based zodiac sign,1,0,Entertainment
11972,hilarious hidden joke simpson probably missed,1,2,Lifestyle
11973,asked john water dating tip said ok sleep asshole,1,2,Lifestyle
11974,truth woman understand,1,2,Lifestyle
11975,perfect gift ginthusiasts,1,2,Lifestyle
11976,reason youre wrong dont think little mix everything,1,2,Lifestyle
11977,know youre going retire,1,2,Lifestyle
11978,would get chaneloween based birth month,1,0,Entertainment
11979,favorite penisthemed cake say sense humor,1,0,Entertainment
11980,harry potter quote could totally desi life,1,2,Lifestyle
11981,man syndrome totally transformed compete bodybuilding contest,1,2,Lifestyle
11982,good luck symbol,1,0,Entertainment
11983,try guy try korean cooking,1,2,Lifestyle
11984,make graveyardthemed dessert dip halloween,1,2,Lifestyle
11985,director american hustle responded jennifer lawrence critique pay inequality,1,1,Politics
11986,chris pratt hot also really inspirational,1,1,Politics
11987,make gifs smiling actor without squealing,1,0,Entertainment
11988,crazy genius spent year archiving every episode mtvs minute,1,2,Lifestyle
11989,period hack,1,2,Lifestyle
11990,know favorite animal based favorite color,1,0,Entertainment
11991,delicious way make favorite candy even better,1,2,Lifestyle
11992,name sondheim musical character,1,0,Entertainment
11993,crazy thing people used believe woman,1,2,Lifestyle
11994,struggle new yorker la,1,1,Politics
11995,make tasty kimchi queso slay life,1,1,Politics
11996,time nick new girl hating people,1,2,Lifestyle
11997,theory zayn malik gigi hadid car together,1,0,Entertainment
11998,thing one tell breast cancer,1,2,Lifestyle
11999,fandom ship war end,1,1,Politics
12000,scary story tell dark reimagined millennials,1,0,Entertainment
12001,carrie fisher daughter new star war movie rocking leia bun,1,0,Entertainment
12002,people wearing glitter tear eye actually catching,1,2,Lifestyle
12003,back future tattoo blow mind,1,3,Crimes
12004,zendayas star war red carpet look holiday party goal,1,2,Lifestyle
12005,here happens go different meetup every day month,1,1,Politics
12006,guess concession stand food item real,1,1,Politics
12007,unapologetic song cheating,1,2,Lifestyle
12008,moment prove step brother funniest movie ever,1,2,Lifestyle
12009,thought everyone swim one mile,1,3,Crimes
12010,tracy morgan receives standing ovation emmy traumatic brain injury,1,1,Politics
12011,hottest new facial expression woman,1,0,Entertainment
12012,said tyrion lannister ron swanson,1,1,Politics
12013,exo gif based zodiac sign,1,1,Politics
12014,everyone think chris martin year left shark,1,1,Politics
12015,kanye west threw kim kardashian pregnancy themed surprise birthday party,1,0,Entertainment
12016,insanely delicious recipe thatll take brunch game next level,1,2,Lifestyle
12017,plussize gym clothes wont sacrifice style,1,2,Lifestyle
12018,lucky people would rather right,1,2,Lifestyle
12019,pizza lover rejoice someone invented necklace hold pizza slice,1,2,Lifestyle
12020,disney princess would look like real life,1,0,Entertainment
12021,thing bunny yoga incredibly cute,1,2,Lifestyle
12022,mean girl premiere peak here proof,1,0,Entertainment
12023,kid recreate childhood halloween costume,1,2,Lifestyle
12024,superhelpful chart teach actually work,1,2,Lifestyle
12025,thing costco food lover understand,1,2,Lifestyle
12026,female tv character soulmate based favorite food,1,0,Entertainment
12027,umbrella worst,1,2,Lifestyle
12028,hardest british flag quiz ever take,1,0,Entertainment
12029,craziest illusion ever,1,1,Politics
12030,two truth lie ed sheeran jamie lawson edition,1,2,Lifestyle
12031,map british people find funny,1,2,Lifestyle
12032,way decorate home actually inspirational,1,2,Lifestyle
12033,acrobatic hoverboard choreography justin biebers sorry may best thing see,1,2,Lifestyle
12034,people natural hair really hear,1,0,Entertainment
12035,here moment justin bieber hailey baldwin met first time,1,0,Entertainment
12036,donald trump gave u best dad move hotline bling parody,1,0,Entertainment
12037,breaking woman v men,1,2,Lifestyle
12038,identify tv show based screencaps drink,1,2,Lifestyle
12039,rescue worker pulled stop make grandmother birthday wish come true,1,1,Politics
12040,here proof one direction feel really really awkward talking zayn,1,0,Entertainment
12041,everyone secretly hate friend,1,2,Lifestyle
12042,time talk good olive garden,1,2,Lifestyle
12043,growing female audience marvel hope invite everyone,1,2,Lifestyle
12044,mall santa everything could make autistic child feel comfortable,1,3,Crimes
12045,people loving twitter account match dog self,1,0,Entertainment
12046,could pas charm owl,1,1,Politics
12047,simply stunning sheer wedding dress,1,0,Entertainment
12048,celebrity look exactly like disney channel character,1,0,Entertainment
12049,beauty skincare product steal bae,1,2,Lifestyle
12050,annoying part halloween,1,2,Lifestyle
12051,ready move,1,2,Lifestyle
12052,thing everyone strong eyebrow know true,1,2,Lifestyle
12053,well really remember living single,1,0,Entertainment
12054,try stuffing chicken parmesan meatball mozzarella see happens,1,3,Crimes
12055,feeling hotline bling video unintentionally captured,1,0,Entertainment
12056,scary movie viewed complete coward,1,0,Entertainment
12057,reason engagement ring much better theyre colorful,1,2,Lifestyle
12058,relived fresher week decade happened,1,3,Crimes
12059,daisy take control agent shield,1,0,Entertainment
12060,bruno mar might headline super bowl,1,2,Lifestyle
12061,dont know text back,1,2,Lifestyle
12062,word everyone stop saying immediately,1,0,Entertainment
12063,wear black,1,2,Lifestyle
12064,movie match zodiac sign,1,0,Entertainment
12065,meet brownie put brownie shame,1,3,Crimes
12066,rainbow brite color kid match personality,1,2,Lifestyle
12067,little thing still time,1,2,Lifestyle
12068,celebrity kid killing u cuteness instagram,1,0,Entertainment
12069,unrealistic standard beauty set art history,1,2,Lifestyle
12070,thing kim kardashian said thatd weird said,1,1,Politics
12071,outfit girl lusted,1,0,Entertainment
12072,disney princess feeling yr foot get fall asleep,1,2,Lifestyle
12073,phone note funny damn reason,1,2,Lifestyle
12074,honey boo boo dropped cringeworthy music video ever,1,0,Entertainment
12075,question secretly wish could ask ex,1,2,Lifestyle
12076,yule log cake literally look like shit,1,0,Entertainment
12077,popup dinner empowering woman restaurant industry,1,1,Politics
12078,make thanksgiving stuffing dream,1,2,Lifestyle
12079,beach wont believe actually exist india,1,0,Entertainment
12080,astronaut told u terrifying moment space,1,2,Lifestyle
12081,cara delevingne opened struggle mental illness,1,2,Lifestyle
12082,well know quote pixar movie,1,0,Entertainment
12083,omg cloud emoji,1,0,Entertainment
12084,kimmy gibbler whip nae nae,1,1,Politics
12085,hate people,1,2,Lifestyle
12086,man us obituary ask people vote donald trump,1,0,Entertainment
12087,eat nothing pizza every single meal,1,2,Lifestyle
12088,think post one greatest rb collaboration time,1,3,Crimes
12089,hilarious tumblr post make question everything know language,1,0,Entertainment
12090,good short term memory,1,0,Entertainment
12091,guy comic hilariously sum truth parent,1,0,Entertainment
12092,underrated makeup brand everyone know,1,2,Lifestyle
12093,george clooney channing tatum took bff test omg,1,2,Lifestyle
12094,insanely clever beautifully decorated cooky,1,2,Lifestyle
12095,patrick one direction band newest delicious member,1,0,Entertainment
12096,need talk brazil,1,3,Crimes
12097,pretty little liar season iq,1,0,Entertainment
12098,people slayed african ankara print,1,2,Lifestyle
12099,taylor swift tattoo get,1,2,Lifestyle
12100,disney allows dying fan see new star war early,1,0,Entertainment
12101,people share helped resist urge selfharm,1,3,Crimes
12102,character right thing,1,0,Entertainment
12103,word mean something completely different get engaged,1,0,Entertainment
12104,word meant something completely different,1,3,Crimes
12105,police officer showed routine call ended falling love puppy,1,3,Crimes
12106,model nipple photshopped away,1,2,Lifestyle
12107,here favourite fall boy album say,1,0,Entertainment
12108,love actually brings together every fandom ever actually lovely,1,2,Lifestyle
12109,lana del rey song based zodiac sign,1,0,Entertainment
12110,know celeb resemble based three question,1,0,Entertainment
12111,ariana grande spoke way woman men magazine sold,1,2,Lifestyle
12112,may single legendary selfie ever taken india,1,0,Entertainment
12113,cenobite,1,0,Entertainment
12114,thing probably didnt know harry potter prisoner azkaban,1,2,Lifestyle
12115,modern makeahead casserole,1,2,Lifestyle
12116,photo prove goat underrated majestic being,1,2,Lifestyle
12117,here first look punisher daredevil going head head,1,0,Entertainment
12118,here actually heal dry chapped lip,1,2,Lifestyle
12119,bingewatch making murderer think solve crime,1,3,Crimes
12120,badass historical woman name daughter,1,0,Entertainment
12121,tweet funny love beauty,1,2,Lifestyle
12122,never think pizza way trying dip,1,2,Lifestyle
12123,history frisco headline,1,3,Crimes
12124,player admit use woman sex,1,1,Politics
12125,hamilton character based zodiac sign,1,0,Entertainment
12126,time dog embodied like sibling,1,2,Lifestyle
12127,time admit honeydew melon garbage,1,3,Crimes
12128,men learned braid hair theyre looking back,1,2,Lifestyle
12129,friday night light high school experience,1,1,Politics
12130,thing didnt know cold caller,1,2,Lifestyle
12131,color test determine like sex,1,1,Politics
12132,ridiculously pretty bra youll want keep day,1,2,Lifestyle
12133,white lie best friend told,1,2,Lifestyle
12134,thing ruby rose looked like mtv emas,1,2,Lifestyle
12135,said cory matthew riley matthew,1,3,Crimes
12136,truth katy perry actual queen halloween,1,2,Lifestyle
12137,motorcycle jacket cozy fall,1,2,Lifestyle
12138,slightly horrifying fact stop biting nail,1,2,Lifestyle
12139,sam hunt break small town video hot problematic,1,1,Politics
12140,alphabet according gilmore girl,1,0,Entertainment
12141,easy trick make waffle taste like churros,1,2,Lifestyle
12142,justin bieber one direction,1,0,Entertainment
12143,geekiest pickup line,1,3,Crimes
12144,beautiful gift people obsessed frida kahlo,1,3,Crimes
12145,slay tinder fkboys,1,0,Entertainment
12146,name iconic music video single screencap,1,0,Entertainment
12147,tv show period drama watching,1,2,Lifestyle
12148,reason link zelda perfect man,1,0,Entertainment
12149,thing make cringe hard youll never recover,1,2,Lifestyle
12150,would say company announced wanted replace robot someday,1,1,Politics
12151,wild way people use placenta,1,3,Crimes
12152,time eddie redmayne magical human alive,1,2,Lifestyle
12153,watch man react modern world year prison,1,2,Lifestyle
12154,british christmas tradition america need adopt,1,3,Crimes
12155,incredibly delicious way eat egg every meal,1,3,Crimes
12156,carrie brownstein amy poehler spontaneously helped couple get married,1,0,Entertainment
12157,little girl see shadow becomes instantly terrified adorable,1,3,Crimes
12158,eddie redmayne going dad couldnt happier,1,2,Lifestyle
12159,memory loss,1,2,Lifestyle
12160,shape quiz determine perceptive,1,0,Entertainment
12161,tweet sleep guaranteed make laugh,1,2,Lifestyle
12162,get slow cooker rib going make happy,1,0,Entertainment
12163,michelle tanner quote motivational poster,1,2,Lifestyle
12164,here rapper got name,1,2,Lifestyle
12165,director gina princebythewood every movie start image,1,0,Entertainment
12166,incredible item every san diego lover need life,1,3,Crimes
12167,picture prove office grossest place earth,1,2,Lifestyle
12168,woman smashing face bread oddly compelling,1,0,Entertainment
12169,match quote grey anatomy character,1,0,Entertainment
12170,evolved,1,1,Politics
12171,psa beware star war hype,1,0,Entertainment
12172,regular people try catch pass nfl quarterback,1,1,Politics
12173,spectacular fast food fails time,1,1,Politics
12174,thing happen date scientist,1,2,Lifestyle
12175,ariana grande perfect response accusation shes skinny,1,2,Lifestyle
12176,international starbucks item need immediately,1,2,Lifestyle
12177,heartbreakingly misspelled tattoo,1,2,Lifestyle
12178,best television moment,1,2,Lifestyle
12179,picture prove bin bag greatest halloween costume time,1,2,Lifestyle
12180,here ditching apple iphone cord changed life,1,3,Crimes
12181,definitely sign daily dog newsletter,1,2,Lifestyle
12182,quiz brighten crap day,1,1,Politics
12183,man made eyeopening video getting interviewed younger self,1,3,Crimes
12184,planttastic halloween costume,1,2,Lifestyle
12185,time justin trudeau thirst went far,1,0,Entertainment
12186,celebrity zodiac sign,1,0,Entertainment
12187,solve puzzle love board game,1,0,Entertainment
12188,movie wont believe turning,1,0,Entertainment
12189,exercise need get shape anywhere,1,1,Politics
12190,strange everyday object people actually stuck butt,1,0,Entertainment
12191,game,1,0,Entertainment
12192,tell u educational nontraditional path,1,1,Politics
12193,singersongwriter got stuck car best damn jam session,1,0,Entertainment
12194,thing happen watch many crime show,1,2,Lifestyle
12195,dude follows wife around world came back india he still killing,1,1,Politics
12196,picture people love pun think funny,1,2,Lifestyle
12197,question every doctor fan answered steven moffat,1,3,Crimes
12198,barguments love camping,1,1,Politics
12199,america ferrera eva longoria perfectly captured like famous latina,1,3,Crimes
12200,best way actually dress body type,1,2,Lifestyle
12201,guy pretended bradley cooper sundance put video,1,2,Lifestyle
12202,crappy roommate,1,0,Entertainment
12203,picture renaissance woman spectacular gravitydefying boob,1,0,Entertainment
12204,science story cant miss bad pharma edition,1,0,Entertainment
12205,video perfectly capture sriracha lover struggle,1,0,Entertainment
12206,reminder pinky brain christmas special make cry every time,1,3,Crimes
12207,coming st time v st time,1,3,Crimes
12208,thing make girl feel old,1,2,Lifestyle
12209,first photo gilmore girl reboot prof lorelai hasnt aged,1,0,Entertainment
12210,michael cera,1,0,Entertainment
12211,gift anyone major wanderlust,1,2,Lifestyle
12212,small award anyone anxiety deserves receive,1,2,Lifestyle
12213,well remember season one hill,1,0,Entertainment
12214,people give flirting,1,2,Lifestyle
12215,major minor key,1,0,Entertainment
12216,time victoria david beckham proved love real,1,2,Lifestyle
12217,strangely emotional moment see another lesbian public,1,2,Lifestyle
12218,know favorite harry potter character based goto ice cream flavor,1,0,Entertainment
12219,britney spear continues perform wardrobe malfunction,1,3,Crimes
12220,reason costco america greatest achievement,1,2,Lifestyle
12221,seagull goose,1,2,Lifestyle
12222,fyi bean even stevens working mall,1,3,Crimes
12223,way get tense holiday family time like pro,1,3,Crimes
12224,thought two idiot american week episode tatort,1,3,Crimes
12225,text sum drunk,1,0,Entertainment
12226,troye sivan song anthem,1,0,Entertainment
12227,snow day recipe cook drink right,1,2,Lifestyle
12228,thing woman wear hijab cant,1,2,Lifestyle
12229,time olly neil milan cutest couple twitter,1,2,Lifestyle
12230,pet damn respect book,1,0,Entertainment
12231,inside amy schumer character,1,2,Lifestyle
12232,rock climb without rope,1,3,Crimes
12233,time pedro pascal human perfection,1,3,Crimes
12234,costume guaranteed win halloween,1,2,Lifestyle
12235,know name based thing hate,1,2,Lifestyle
12236,tip hack get tiny home,1,2,Lifestyle
12237,hogwarts college,1,0,Entertainment
12238,reminder demi lovato look fierce af right,1,3,Crimes
12239,picture instantly destroy friendship,1,3,Crimes
12240,guy animated class doodle epic dance video,1,2,Lifestyle
12241,thing probably didnt know harry potter chamber secret,1,2,Lifestyle
12242,reason marriage actually pretty awesome,1,2,Lifestyle
12243,stone cold steve austin try fancy cocktail first time,1,2,Lifestyle
12244,take buzzfeed fiveday inbox cleanse stop hating email,1,2,Lifestyle
12245,here real vegan actually eat,1,2,Lifestyle
12246,ryan reynolds flew halfway across world see blake lively day,1,0,Entertainment
12247,creepiest news story,1,0,Entertainment
12248,poll letter alphabet best,1,1,Politics
12249,jawdropping halloween costume kid wheelchair,1,2,Lifestyle
12250,rafael nadals make fcking day,1,1,Politics
12251,harry style justin bieber,1,0,Entertainment
12252,know first love,1,0,Entertainment
12253,always say wrong thing,1,2,Lifestyle
12254,whats personal slogan,1,2,Lifestyle
12255,tell phone screen cracked,1,2,Lifestyle
12256,iggy azalea tried clap back ti twitter,1,3,Crimes
