,headline,clickbait,topices,popular_topices
3975,actually know word mean,1,0,Entertainment
3976,search next battlestar galactica,1,1,Politics
3977,many book youtube star read,1,0,Entertainment
3978,here everything shape say,1,1,Politics
3979,ginger dessert make time christmas,1,0,Entertainment
3980,ellen page get flirt julianne moore first freeheld clip,1,2,Lifestyle
3981,weird question gay couple get,1,2,Lifestyle
3982,thing american student studying uk understand,1,2,Lifestyle
3983,never forget hilary duff sucked dude thumb music video,1,0,Entertainment
3984,urban decay released gwen stefani palette people losing mind,1,2,Lifestyle
3985,actually worst gilmore girl suitor,1,0,Entertainment
3986,food spectacularly failed live expectation,1,1,Politics
3987,much love oscar isaac,1,2,Lifestyle
3988,here year history drug america,1,3,Crimes
3989,heartbreaking confession people unrequited love,1,2,Lifestyle
3990,photo anyone menstruates understand,1,2,Lifestyle
3991,south vacay based zodiac sign,1,0,Entertainment
3992,thing wish known first year university,1,2,Lifestyle
3993,reason need watching billy street,1,0,Entertainment
3994,scotch expert review cheap whiskey,1,1,Politics
3995,watch two men jetpacks fly alongside jumbo jet,1,1,Politics
3996,gorgeous way forget ex,1,0,Entertainment
3997,way life one big game tetri,1,3,Crimes
3998,britney spear hilariously pranked bodyguard help neil patrick harris,1,2,Lifestyle
3999,people try balut first time,1,3,Crimes
4000,moment relationship becomes official,1,2,Lifestyle
4001,character awkward,1,2,Lifestyle
4002,here save money clean eating challenge,1,1,Politics
4003,harry potter ghost,1,2,Lifestyle
4004,time tumblr funniest game throne,1,0,Entertainment
4005,good table manner,1,1,Politics
4006,know zodiac sign based picture zayn malik choose,1,0,Entertainment
4007,breathtaking avocado toast happened,1,2,Lifestyle
4008,probably qualify astronaut dont even know,1,2,Lifestyle
4009,nba superstar stephen curry open life dad,1,2,Lifestyle
4010,new study show college student prefer read paper book,1,2,Lifestyle
4011,darth vader mixed donald trump quote hilarious,1,0,Entertainment
4012,reason addams family best family ever,1,1,Politics
4013,privileged crossword say everything patriarchy,1,0,Entertainment
4014,chart perfectly sum life toronto,1,0,Entertainment
4015,leadership quality suit personality,1,1,Politics
4016,scientist dont know make latest pluto photo,1,0,Entertainment
4017,deserve join rank marauder,1,1,Politics
4018,tell u yourselfie taylor kinney,1,0,Entertainment
4019,hilarious tweet movie,1,2,Lifestyle
4020,samantha bee created rape threatline troll genius,1,2,Lifestyle
4021,photographer gregory crewdson release haunting new series,1,1,Politics
4022,kitchen cheat sheet know,1,3,Crimes
4023,lil kim charmed whole kardashian family kanyes fashion show,1,1,Politics
4024,listen ariana grandes new ep christmas chill,1,2,Lifestyle
4025,memory alan rickman,1,0,Entertainment
4026,winter dinner anyone make,1,2,Lifestyle
4027,guy pro baseball player mlb fan,1,0,Entertainment
4028,people confess college regret,1,2,Lifestyle
4029,know disney princess dislike based zodiac,1,0,Entertainment
4030,one direction music video favorite,1,0,Entertainment
4031,soup cancelled year run,1,1,Politics
4032,thing make sense ungirly girl,1,2,Lifestyle
4033,harry potterthemed bar opened pay respect,1,2,Lifestyle
4034,here cast shes man look like today,1,0,Entertainment
4035,isnt lovely,1,2,Lifestyle
4036,like ina garten giada de laurentiis,1,3,Crimes
4037,christmas card mexican mom would send,1,2,Lifestyle
4038,said spongebob squarepants edition,1,3,Crimes
4039,soup salad,1,2,Lifestyle
4040,tell u story sexism college,1,2,Lifestyle
4041,tee shirt people put hot sauce hot sauce,1,1,Politics
4042,men morehouse give future son bae goal,1,2,Lifestyle
4043,photo sheep snowy field mess mind,1,2,Lifestyle
4044,thing american teen british girl insanely jealous,1,2,Lifestyle
4045,time adventure time really wanted make cry,1,0,Entertainment
4046,hear clip good charlotte comeback song,1,0,Entertainment
4047,look wittle doggy practising india republic day parade,1,1,Politics
4048,time used call cell phone,1,3,Crimes
4049,trailer star trek beyond show u new villain,1,0,Entertainment
4050,lesbian sorority confession,1,2,Lifestyle
4051,tree would getting ton as human,1,3,Crimes
4052,survived suicide attempt,1,3,Crimes
4053,confession people feel guilty masturbating,1,2,Lifestyle
4054,reason watch local news often,1,3,Crimes
4055,finally found tv character whose depression look like mine,1,0,Entertainment
4056,photo wont make sense anyone doesnt wear makeup,1,2,Lifestyle
4057,animal know daily struggle,1,2,Lifestyle
4058,time urban dictionary straight ruined favorite animal,1,2,Lifestyle
4059,whats stupidest way youve ever broken computer,1,3,Crimes
4060,thing everyone gone therapy understand,1,2,Lifestyle
4061,much soul destroyed working retail,1,2,Lifestyle
4062,food natural genetically modified,1,3,Crimes
4063,advice wish someone told got married,1,2,Lifestyle
4064,wise life lesson mindy kalings new book,1,1,Politics
4065,inceptionlike image blow mind,1,3,Crimes
4066,tv show political junky watch,1,2,Lifestyle
4067,martian went bestselling novel blockbuster film,1,0,Entertainment
4068,thing youll understand youre addicted snacking,1,2,Lifestyle
4069,rihanna lyric need instagram caption,1,0,Entertainment
4070,time people took passive aggression next level,1,2,Lifestyle
4071,everyones freaking morrison pizza look rude,1,0,Entertainment
4072,euphoric experience people love stationery,1,2,Lifestyle
4073,dog accidentally ran halfmarathon placed seventh,1,1,Politics
4074,movie tv retrospective make nostalgic,1,3,Crimes
4075,daredevil jessica jones,1,3,Crimes
4076,game play tonight show jimmy fallon,1,0,Entertainment
4077,know favorite christmas movie based youre hungry,1,0,Entertainment
4078,thing prove period actually pretty funny,1,2,Lifestyle
4079,would use switch turn sperm,1,1,Politics
4080,old favorite tv movie character,1,0,Entertainment
4081,kill cockroach,1,1,Politics
4082,year amazing science picture,1,0,Entertainment
4083,lowsugar dessert recipe need try asap,1,2,Lifestyle
4084,thing youll understand always need pee,1,2,Lifestyle
4085,lesbian woman ask gay men question want know,1,0,Entertainment
4086,doug pug try sexy halloween costume wow everyone,1,2,Lifestyle
4087,couple set romantic date taco bell best thing ever,1,2,Lifestyle
4088,kim kardashian instagrammed might photo time,1,1,Politics
4089,insanely relatable stage partying introvert,1,2,Lifestyle
4090,hilarious tweet exhausted time,1,2,Lifestyle
4091,agonizing truth people feel much,1,2,Lifestyle
4092,chart speak everyone fucking love sleep,1,2,Lifestyle
4093,nickelodeon working reviving hey arnold new tv movie,1,0,Entertainment
4094,horrifyingly cute zombie treat actually make,1,2,Lifestyle
4095,incredibly bitchy text period would send,1,2,Lifestyle
4096,know taylor swift hairstyle would look best,1,2,Lifestyle
4097,jennifer lopez perfect jimmy fallons ew,1,3,Crimes
4098,bought insane star war toy dont,1,2,Lifestyle
4099,cute little poem accurately describe love,1,2,Lifestyle
4100,government officer caught playing candy crush meeting farmer grievance,1,1,Politics
4101,really mermaid,1,0,Entertainment
4102,american listened coke studio first time pretty damn impressed,1,0,Entertainment
4103,christmas would rather question impossible answer,1,0,Entertainment
4104,canadian tell photo taken afternoon night,1,1,Politics
4105,celebrity tbt photo need see week,1,3,Crimes
4106,woman hurt vagina biking,1,3,Crimes
4107,cute dog picture help put whatever youre putting,1,0,Entertainment
4108,time reached peak new york time,1,1,Politics
4109,know old based favorite kitten,1,0,Entertainment
4110,movie trailer perfectly capture postgrad struggle unemployment,1,0,Entertainment
4111,creepy terrence howard kiss emmy,1,2,Lifestyle
4112,holiday book every ya lover need read,1,2,Lifestyle
4113,food shut winter,1,3,Crimes
4114,avenger like based zodiac sign,1,0,Entertainment
4115,know disney movie food,1,0,Entertainment
4116,bow wow clue kill time grammys hilarious,1,2,Lifestyle
4117,sam smith recorded new james bond song,1,0,Entertainment
4118,chocolate abuelita best hot chocolate ever try,1,3,Crimes
4119,falkor luck dragon stuffed animal every neverending story fan need,1,0,Entertainment
4120,poem helped depression,1,2,Lifestyle
4121,everyone wasnt allowed celebrate halloween,1,0,Entertainment
4122,kid stopped way second base tell baseball coach love,1,0,Entertainment
4123,relationship goal actually worth achieving,1,2,Lifestyle
4124,video ron swanson drinking whisky minute yule log need,1,0,Entertainment
4125,make butch hot,1,1,Politics
4126,guess british people taking piss donald trump,1,0,Entertainment
4127,people got thirsty novak djokovic mtv emas,1,2,Lifestyle
4128,second clip make embarrassing moment seem like gift,1,2,Lifestyle
4129,know obscure cereal mascot based three question,1,0,Entertainment
4130,little girl asked mom friend dad melt heart,1,2,Lifestyle
4131,diverse world london seen bus window,1,1,Politics
4132,people read craziest shit grandma ever said,1,2,Lifestyle
4133,tiny canadian house tiny adorable corgi elevator cant handle,1,3,Crimes
4134,early disney show match zodiac,1,0,Entertainment
4135,weatherman day learned,1,0,Entertainment
4136,guess ariana grande video youtube comment,1,0,Entertainment
4137,seth rogen joseph gordonlevitt anthony mackie play epic game never ever,1,3,Crimes
4138,woman claim theyve made app let rate people internet furious,1,2,Lifestyle
4139,new coen brother movie time everyone sort closet,1,3,Crimes
4140,chart longtime bffs understand,1,2,Lifestyle
4141,time boston terrier cutest dog internet,1,2,Lifestyle
4142,answer basic psychology question,1,0,Entertainment
4143,thing youll know youre relationship someone doesnt drink,1,2,Lifestyle
4144,musical girl group would,1,0,Entertainment
4145,people absolutely idea,1,2,Lifestyle
4146,friend trivia question every true fan able answer,1,0,Entertainment
4147,people really fucking blew,1,2,Lifestyle
4148,christmas song hater,1,0,Entertainment
4149,pigskin blanket nfl divisional round pick,1,3,Crimes
4150,reason elf always favorite christmas movie,1,0,Entertainment
4151,simpson movie tribute ever wanted see,1,0,Entertainment
4152,photo every perfectionist find pleasing,1,2,Lifestyle
4153,would smooch animal,1,2,Lifestyle
4154,male rapper soulmate based zodiac sign,1,0,Entertainment
4155,thing happen song come club,1,0,Entertainment
4156,turkey wondering everyones acting weird,1,0,Entertainment
4157,type guy ideal man,1,1,Politics
4158,learned celebrate eid al adha america,1,1,Politics
4159,thing people love christmas december,1,0,Entertainment
4160,chelsea handler share experience drug chelsea,1,3,Crimes
4161,hero bride responded car crash wedding dress,1,3,Crimes
4162,disney movie directed tim burton,1,0,Entertainment
4163,stop working play interactive puppy video,1,3,Crimes
4164,one mindblowing detail missed little mermaid,1,0,Entertainment
4165,watch people stop everything save baby elephant well cry happy tear,1,1,Politics
4166,date weeknd drake,1,0,Entertainment
4167,thing girl height boyfriend know,1,2,Lifestyle
4168,definitive guide kissing,1,3,Crimes
4169,rachel platten sang hit fight song young cancer patient punch right feel,1,1,Politics
4170,insanely awesome starbucks need see,1,2,Lifestyle
4171,guess pretty little liar episode based screencap,1,0,Entertainment
4172,wait put penis mouthvaginaanus robot,1,0,Entertainment
4173,know elder scroll race based play skyrim,1,2,Lifestyle
4174,cat obviously planning murder,1,0,Entertainment
4175,sign youre,1,0,Entertainment
4176,cozy sweater people literally always cold,1,2,Lifestyle
4177,coffee shop open door stray dog every night,1,1,Politics
4178,man bun making guy go bald kind worst,1,0,Entertainment
4179,said annalise keating olivia pope,1,1,Politics
4180,iconic female character without makeup,1,0,Entertainment
4181,tattoo artist honest,1,0,Entertainment
4182,people taking demise twitter fave well,1,0,Entertainment
4183,scene kid emo kid,1,2,Lifestyle
4184,photo guaranteed upset,1,2,Lifestyle
4185,picture make way much sense college student,1,2,Lifestyle
4186,shes texting back,1,2,Lifestyle
4187,unforgettable way pizzatize superbowl party,1,3,Crimes
4188,prince william give emotional rare speech princess diana,1,3,Crimes
4189,poot want see,1,2,Lifestyle
4190,thing sensible people relate,1,2,Lifestyle
4191,time chris martin really excited puppy,1,0,Entertainment
4192,demoed yoshis woolly world adorably ridiculous,1,2,Lifestyle
4193,time fresh prince belair funniest show ever made,1,2,Lifestyle
4194,going hell,1,2,Lifestyle
4195,new wonder woman movie officially look amazing,1,0,Entertainment
4196,couple refused call wedding despite blizzard,1,2,Lifestyle
4197,mom took laughoutloud photo baby magazine,1,0,Entertainment
4198,year shibas proved meme,1,3,Crimes
4199,tell u yourselfie derek theler,1,2,Lifestyle
4200,here cast hey dude look like,1,0,Entertainment
4201,horrible thing happen mercury retrograde,1,2,Lifestyle
4202,show u best christmas ornament youve ever made,1,2,Lifestyle
4203,time tumblr felt thing jeremy corbyn,1,0,Entertainment
4204,duet early youve forgotten existed,1,1,Politics
4205,tell u tiny wonderful thing thankful year,1,2,Lifestyle
4206,know cute baby panda gif need see today,1,2,Lifestyle
4207,greatest supermarket substitution fails,1,2,Lifestyle
4208,like new york mets fan,1,0,Entertainment
4209,euphoric experience everyone love eat,1,2,Lifestyle
4210,would leave bachelor paradise based zodiac sign,1,0,Entertainment
4211,powerful quote make hopeful future,1,2,Lifestyle
4212,cast l word aged incredibly well,1,0,Entertainment
4213,hilarious tweet ghost make laugh loud every time,1,2,Lifestyle
4214,actually know meaning commonly misused word,1,3,Crimes
4215,reyinspired product actually buy,1,2,Lifestyle
4216,kendrick lamar performed brand new song tonight show,1,0,Entertainment
4217,pick right slice pizza,1,2,Lifestyle
4218,totally forgot ytv show,1,0,Entertainment
4219,basic eye makeup style give life,1,2,Lifestyle
4220,taco recipe sexually awaken taste bud,1,0,Entertainment
4221,im adopted im,1,0,Entertainment
4222,photographer noshow wedding bride received surprise lifetime,1,0,Entertainment
4223,reason cat owner appreciation day,1,1,Politics
4224,insanely creative matching tattoo idea,1,3,Crimes
4225,people try holidaythemed cocktail,1,2,Lifestyle
4226,way get help feel completely alone,1,2,Lifestyle
4227,ridiculous way people injured kid,1,2,Lifestyle
4228,real guide finding hairstyle flatters face,1,0,Entertainment
4229,insanely delicious nutella treat blow new year diet,1,2,Lifestyle
4230,picture prove everyone totally faking,1,2,Lifestyle
4231,hardest tube station quiz youll take today,1,0,Entertainment
4232,amazing thing make fall love portland maine,1,2,Lifestyle
4233,romantic idea elevate engagement picture,1,2,Lifestyle
4234,type drunk youve definitely told sims,1,2,Lifestyle
4235,celebrity tree christmas morning,1,3,Crimes
4236,haunted hotel uk actually stay halloween,1,2,Lifestyle
4237,cringiest facebook post history cringe,1,3,Crimes
4238,thing might know taylor swift wood video,1,2,Lifestyle
4239,sign actually senioritis,1,3,Crimes
4240,different people live identical flat building,1,3,Crimes
4241,woman wearing exactly theyve told totally awesome,1,2,Lifestyle
4242,man decided put jet fuel cant melt steel beam conspiracy theory test,1,3,Crimes
4243,friendly reminder last christmas jimmy eat world best christmas song existence,1,0,Entertainment
4244,know youre kid,1,2,Lifestyle
4245,dog feel type way bathtime,1,3,Crimes
4246,trend hoping happen,1,2,Lifestyle
4247,people lost pound share best tip getting started,1,2,Lifestyle
4248,exciting creative way eat egg,1,3,Crimes
4249,salma hayek go er embarrassing tshirt,1,1,Politics
4250,stunning gift wrapping idea minimalist,1,2,Lifestyle
4251,honest piece advice scientist yearold nobel laureate,1,2,Lifestyle
4252,thing spanish major tired hearing,1,2,Lifestyle
4253,successfully proposed girlfriend advice,1,2,Lifestyle
4254,highly important question adulthood answered michael ian black,1,2,Lifestyle
4255,important picture shia labeouf watching movie,1,0,Entertainment
4256,jennifer lawrence never looked better last night,1,1,Politics
4257,name game single screenshot,1,0,Entertainment
4258,chart perfectly illustrate filipino twentysomething life,1,0,Entertainment
4259,thing youll understand best friend massive troll,1,2,Lifestyle
4260,compatible celebrity crush,1,0,Entertainment
4261,scream queen character based opinion harry potter,1,0,Entertainment
4262,people look strikingly similar leonardo dicaprio,1,3,Crimes
4263,try keep chill colin farrell hair turning daddy gray,1,3,Crimes
4264,threeingredient snack make thanksgiving easy af,1,2,Lifestyle
4265,adult sit santa lap first time,1,2,Lifestyle
4266,picture make responsible adult extremely angry,1,2,Lifestyle
4267,another round episode frimfram fittlesworth,1,2,Lifestyle
4268,contact everyone phone,1,2,Lifestyle
4269,much anna kendrick fan actually,1,0,Entertainment
4270,time cat made sense,1,2,Lifestyle
4271,know drunk youll christmas,1,2,Lifestyle
4272,time elf shelf felt like horror movie,1,0,Entertainment
4273,time england made feel feeling,1,1,Politics
4274,surprising beauty hack using coffee ground,1,2,Lifestyle
4275,mouthwatering recipe try,1,2,Lifestyle
4276,need talk hot quasimodo,1,0,Entertainment
4277,need see insanely sexy cartoon lion,1,2,Lifestyle
4278,miley cyrus freak phone call hilary duff throwback interview,1,0,Entertainment
4279,kardashian jenner,1,1,Politics
4280,online shop based southwest shopping,1,2,Lifestyle
4281,movie bad theyre good,1,0,Entertainment
4282,wicked proposal reignite obsession show,1,1,Politics
4283,would crime show,1,1,Politics
4284,thing cool middle school definitely arent,1,2,Lifestyle
4285,pick new year cat find hold,1,2,Lifestyle
4286,lead squad,1,2,Lifestyle
4287,best product get sephora gift card,1,2,Lifestyle
4288,thing everyone scared spider understand,1,2,Lifestyle
4289,disney hero villain,1,0,Entertainment
4290,new horror movie make scared mom grandma,1,0,Entertainment
4291,rashida jones doesnt understand half movie arent woman,1,2,Lifestyle
4292,buy country,1,0,Entertainment
4293,tweet failed hard failed,1,1,Politics
4294,time happened gay bar didnt stay gay bar,1,2,Lifestyle
4295,bodypositive book youll want read daughter,1,0,Entertainment
4296,tell u yourselfie jake lacy,1,1,Politics
4297,everything need know longest movie ever made,1,0,Entertainment
4298,female friendship lesson phoebe monica rachel,1,3,Crimes
4299,chickentweet motivational poster,1,2,Lifestyle
4300,hilarious photo series highlight much cricket changed year,1,2,Lifestyle
4301,salted coffee le bitter,1,2,Lifestyle
4302,know plan spending valentine day,1,1,Politics
4303,ridiculously irresistible way eat oreo,1,0,Entertainment
4304,stage getting shitfaced week,1,3,Crimes
4305,thing former baby lesbian understand,1,2,Lifestyle
4306,well know minor detail friend,1,0,Entertainment
4307,lesson younger yearold sister taught,1,0,Entertainment
4308,indian copywriter owe u explanation ad,1,3,Crimes
4309,incredible photo icelandic glacier make want go right,1,0,Entertainment
4310,best thing happened,1,2,Lifestyle
4311,thing black people deal daily basis,1,2,Lifestyle
4312,well actually know addams family,1,1,Politics
4313,guess season met mother based lily hair,1,0,Entertainment
4314,chocolate dessert completely mesmerizing,1,3,Crimes
4315,dog really pleased,1,3,Crimes
4316,one dude pentatonix look like howie backstreet boy,1,2,Lifestyle
4317,time discussed dumbledore totally screwed slytherin house,1,2,Lifestyle
4318,throwback recipe youll want try right,1,2,Lifestyle
4319,depressing meal make cry ketchuptopped spaghetti,1,3,Crimes
4320,moment simpson always make ugly cry,1,2,Lifestyle
4321,lonely luke latest hilarious star war parody twitter account,1,0,Entertainment
4322,would time travel past future,1,2,Lifestyle
4323,glorious bailey cocktail delight tastebud,1,0,Entertainment
4324,mouthwatering breakfast casserole thatll change life,1,2,Lifestyle
4325,thing probably didnt know sisterhood traveling pant,1,2,Lifestyle
4326,fortune cooky existed thirtysomethings,1,1,Politics
4327,time internet reminded u friend zone isnt real,1,3,Crimes
4328,question determine actual age,1,0,Entertainment
4329,here cast high school musical look like,1,0,Entertainment
4330,well remember lyric molly smile uptown girl,1,0,Entertainment
4331,breakfast look like around world,1,0,Entertainment
4332,watch transgender teacher comfort gendernonconforming student,1,3,Crimes
4333,pas cookie tin test,1,3,Crimes
4334,people legitimately believe theyre part jedi order,1,2,Lifestyle
4335,chris hemsworth grappling longer sexiest man alive,1,2,Lifestyle
4336,said gossip girl,1,3,Crimes
4337,thing black woman told hair may total b,1,2,Lifestyle
4338,sex horror story thatll make feel better love life,1,2,Lifestyle
4339,sex toy match personality,1,0,Entertainment
4340,fact sleep probably didnt know,1,2,Lifestyle
4341,hairstyle curly hair need try asap,1,2,Lifestyle
4342,best tip managing adhd work,1,0,Entertainment
4343,powerful science photo week,1,2,Lifestyle
4344,really happens girl bathroom,1,2,Lifestyle
4345,halloween candy match zodiac sign,1,0,Entertainment
4346,justin trudeau meet taylor swift hilarious parody,1,0,Entertainment
4347,guess kind snapchatter based single question,1,0,Entertainment
4348,eyebrow product actually worth hype,1,2,Lifestyle
4349,blog full hairy ball landscape make want gouge eye nsfw,1,2,Lifestyle
4350,reason never movie greater thing hate,1,2,Lifestyle
4351,lady gaga song anthem,1,0,Entertainment
4352,beautiful bible verse,1,3,Crimes
4353,heartbreaking confession working retail holiday,1,2,Lifestyle
4354,thing need know baby daddy star chelsea kane,1,0,Entertainment
4355,football aside tom brady take really cute dad pic,1,2,Lifestyle
4356,happens blizzard strike wedding day,1,1,Politics
4357,stock photo represents work bff,1,0,Entertainment
4358,french braid bun damn pretty hurt,1,0,Entertainment
4359,natalia tena sort harry potter character game throne house,1,0,Entertainment
4360,watch tiny hamster throw adorable halloween party,1,2,Lifestyle
4361,truth eurasian know well,1,2,Lifestyle
4362,spot real peanut character fake,1,0,Entertainment
4363,well sort hogwarts house based least favorite house,1,0,Entertainment
4364,well remember write sin tragedy panic disco,1,0,Entertainment
4365,nature photo taken blow away,1,0,Entertainment
4366,happened day january th,1,0,Entertainment
4367,thing happen girl toilet every nightclub,1,2,Lifestyle
4368,time amy schumer got way real woman,1,2,Lifestyle
4369,new jersey,1,3,Crimes
4370,twitter skewered steve harvey announcing wrong miss universe winner,1,0,Entertainment
4371,fka twig cover sias elastic heart perfect thing ever,1,0,Entertainment
4372,incredibly rare endangered baby animal,1,3,Crimes
4373,essay read sex scene actually sexy confident black men debt,1,2,Lifestyle
4374,thing probably didnt notice jessica jones,1,2,Lifestyle
4375,totally wild fast food item need immediately,1,2,Lifestyle
4376,twolegged kitten recovered starvation tiny wheelchair,1,3,Crimes
4377,look golden globe,1,2,Lifestyle
4378,sign may actually addicted hajmola,1,0,Entertainment
4379,latino v hispanic,1,3,Crimes
4380,world landmark could look like epic drought,1,2,Lifestyle
4381,thing happen bff start dating someone,1,2,Lifestyle
4382,make harry potter hilarious replacing every wand penis,1,2,Lifestyle
4383,reason samoyed animal,1,0,Entertainment
4384,dj khaled snapchat quote motivational poster,1,2,Lifestyle
4385,dear hairy girl alone,1,2,Lifestyle
4386,makeup brand use based zodiac sign,1,2,Lifestyle
4387,photo wont make sense people perfect nail,1,2,Lifestyle
4388,match adele song album,1,0,Entertainment
4389,woman deliciously unhealthy instagram account hilarious,1,3,Crimes
4390,cara delevingne hit back robb stark called unprofessional,1,2,Lifestyle
4391,event untimely disappearance,1,0,Entertainment
4392,let settle would dog wear pant,1,2,Lifestyle
4393,trick help get amazing even eyebrow,1,2,Lifestyle
4394,remember detail first episode gilmore girl,1,0,Entertainment
4395,youve making papa rellenas wrong entire life,1,2,Lifestyle
4396,know kind man get,1,0,Entertainment
4397,greatest photo taken place inside photo booth,1,2,Lifestyle
4398,remember famous love actually scene,1,0,Entertainment
4399,fyi dj mustard called dj mustard,1,0,Entertainment
4400,idea budgetfriendly beach weekend getaway new yorkers,1,1,Politics
4401,marvel movie looking forward,1,0,Entertainment
4402,song actually older today year,1,0,Entertainment
4403,actor leading man,1,0,Entertainment
4404,struggle kpop fan youre korean,1,2,Lifestyle
4405,identify disney movie based screenshot,1,0,Entertainment
4406,sign mom might cool,1,2,Lifestyle
4407,powerful science photo month,1,2,Lifestyle
4408,kate hudson jimmy fallon played perfect game dubsmash together,1,0,Entertainment
4409,get christmas based favorite big bang theory character,1,0,Entertainment
4410,upon time made two extremely exciting announcement,1,1,Politics
4411,backstage celebrity instagrams emmy,1,3,Crimes
4412,spot real disney character fake,1,0,Entertainment
4413,able handle new real housewife atlanta trailer,1,0,Entertainment
4414,recreated photo kid cry santa lap,1,2,Lifestyle
